,tweet_id,timestamp,text,name,stages,rating,jpg_url,img_num,p1,p1_conf,p1_dog,p2,p2_conf,p2_dog,p3,p3_conf,p3_dog,retweet_count,favourite_count
1380,677687604918272002,2015-12-18 03:11:30,This was Cindy's face when she heard Susan forgot the snacks for after the kid's soccer game. 11/10 https://t.co/gzkuVGRgAD,,,1.1,https://pbs.twimg.com/media/CWehRdEWIAAySyO.jpg,1,Pembroke,0.573047,True,sunglasses,0.012675799999999997,False,golden_retriever,0.0108047,True,950,2681
1381,677673981332312066,2015-12-18 02:17:22,Endangered triangular pup here. Could be a wizard. Caught mid-laugh. No legs. Just fluff. Probably a wizard. 9/10 https://t.co/GFVIHIod0Z,,,0.9,https://pbs.twimg.com/media/CWeU5LBWEAA8F0J.jpg,1,Maltese_dog,0.817908,True,Angora,0.00778051,False,Pomeranian,0.00221842,True,1677,3603
1382,677662372920729601,2015-12-18 01:31:14,"In honor of the new Star Wars movie. Here's Yoda pug. 12/10 pet really well, would I https://t.co/pvjdRn00XH",,,1.2,https://pbs.twimg.com/media/CWeKTZTWsAA5R3Z.jpg,1,cowboy_hat,0.25611,False,trench_coat,0.012708599999999997,False,cloak,0.007143889999999998,False,1101,2134
1383,677644091929329666,2015-12-18 00:18:36,This is a dog swinging. I really enjoyed it so I hope you all do as well. 11/10 https://t.co/Ozo9KHTRND,,,1.1,https://pbs.twimg.com/ext_tw_video_thumb/677644010865999872/pu/img/zVHEMYnJKzq1SauT.jpg,1,Chihuahua,0.626236,True,Italian_greyhound,0.012848300000000002,True,swing,0.00598404,False,886,2040
1384,677573743309385728,2015-12-17 19:39:03,This is Sandy. He's sexually confused. Thinks he's a pigeon. Also an All-American cheese catcher. 10/10 so petable https://t.co/Htu8plSqEu,Sandy,,1.0,https://pbs.twimg.com/media/CWc5uVPXIAErLYr.jpg,2,patio,0.5350699999999999,False,folding_chair,0.00804192,False,parallel_bars,0.0034796499999999995,False,819,2322
1385,677565715327688705,2015-12-17 19:07:09,Contortionist pup here. Inside pentagram. Clearly worships Satan. Known to slowly push fragile stuff off tables 6/10 https://t.co/EX9oR55VMe,,,0.6,https://pbs.twimg.com/media/CWcybBmWcAAigAQ.jpg,1,basset,0.397295,True,Welsh_springer_spaniel,0.0199554,True,purse,0.0105641,False,513,1409
1386,677557565589463040,2015-12-17 18:34:46,Reckless pupper here. Not even looking at road. Absolute menace. No regard for fellow pupper lives. 10/10 still cute https://t.co/96IBkOYB7j,,pupper,1.0,https://pbs.twimg.com/media/CWcrAVQWEAA6QMp.jpg,1,seat_belt,0.27725700000000003,False,Shih-Tzu,0.0249017,True,Pekinese,0.0209213,True,1322,2665
1387,677547928504967168,2015-12-17 17:56:29,Not much to say here. I just think everyone needs to see this. 12/10 https://t.co/AGag0hFHpe,,,1.2,https://pbs.twimg.com/media/CWciPonWEAUOqLD.jpg,1,American_Staffordshire_terrier,0.914978,True,Staffordshire_bullterrier,0.008439529999999999,True,boxer,4.61663e-05,True,4076,7568
1388,677530072887205888,2015-12-17 16:45:31,Say hello to Axel. He's a Black Chevy Pinot on wheels. 0 to 60 in 5.7 seconds (if downhill). 9/10 I call shotgun https://t.co/DKe9DBnnHE,Axel,,0.9,https://pbs.twimg.com/media/CWcSAI-WUAAOB9W.jpg,1,Staffordshire_bullterrier,0.6892590000000001,True,Norwegian_elkhound,0.0026121,True,American_Staffordshire_terrier,0.00230747,True,250,1161
1389,677334615166730240,2015-12-17 03:48:51,This dog gave up mid jump. 9/10 https://t.co/KmMv3Y2zI8,,,0.9,https://pbs.twimg.com/media/CWZgPPUWUAAUOvu.jpg,2,Lakeland_terrier,0.859392,True,Airedale,0.00672917,True,Irish_water_spaniel,0.0049530600000000004,True,328,1477
1390,677331501395156992,2015-12-17 03:36:28,Meet Humphrey. He's a Northern Polyp Viagra. One ear works. Face stuck like that. Always surprised. 9/10 petable af https://t.co/FS7eJQM2F4,Humphrey,,0.9,https://pbs.twimg.com/media/CWZdaGxXAAAjGjb.jpg,1,beagle,0.313464,True,boxer,0.021850300000000007,True,French_bulldog,0.0106462,True,265,1189
1391,677328882937298944,2015-12-17 03:26:04,This is Derek. All the dogs adore Derek. He's a great guy. 10/10 really solid pup https://t.co/KgcsGNb61s,Derek,,1.0,https://pbs.twimg.com/media/CWZbBlAUsAAjRg5.jpg,1,water_buffalo,0.42425,False,kelpie,0.0029054099999999998,True,Staffordshire_bullterrier,0.00284697,True,1693,3938
1392,677314812125323265,2015-12-17 02:30:09,"Meet Tassy &amp; Bee. Tassy is pretty chill, but Bee is convinced the Ruffles are haunted. 10/10 &amp; 11/10 respectively https://t.co/fgORpmTN9C",Tassy,,1.0,https://pbs.twimg.com/media/CWZOOIUW4AAQrX_.jpg,2,Blenheim_spaniel,0.924127,True,Japanese_spaniel,0.00547901,True,Chihuahua,0.000820404,True,611,1799
1393,677301033169788928,2015-12-17 01:35:24,This is Juckson. He's totally on his way to a nascar race. 5/10 for Juckson https://t.co/IoLRvF0Kak,Juckson,,0.5,https://pbs.twimg.com/media/CWZBsjPWsAAZFFl.jpg,1,Japanese_spaniel,0.6611779999999999,True,Pekinese,0.0150119,True,Chihuahua,0.011972,True,471,1362
1394,677269281705472000,2015-12-16 23:29:14,This is the happiest pupper I've ever seen. 10/10 would trade lives with https://t.co/ep8ATEJwRb,,pupper,1.0,https://pbs.twimg.com/media/CWYk0WxWoAAEwRt.jpg,1,Shetland_sheepdog,0.656616,True,collie,0.0195405,True,German_shepherd,0.00131032,True,790,2164
1395,677228873407442944,2015-12-16 20:48:40,Say hello to Chuq. He just wants to fit in. 11/10 https://t.co/hGkMCjZzn4,Chuq,,1.1,https://pbs.twimg.com/media/CWYAEINW4AIuw8P.jpg,1,common_iguana,0.566338,False,tennis_ball,0.0154646,False,green_lizard,0.00449758,False,1840,3837
1396,677187300187611136,2015-12-16 18:03:28,Here we see a Byzantine Rigatoni. Very aerodynamic. No eyes. Actually not windy here they just look like that. 9/10 https://t.co/gzI0m6wXRo,,,0.9,https://pbs.twimg.com/media/CWXaQMBWcAAATDi.jpg,1,English_setter,0.282396,True,Shih-Tzu,0.008411189999999999,True,Old_English_sheepdog,0.0059538,True,1033,2981
1397,676975532580409345,2015-12-16 04:01:59,This is Cooper. He doesn't know how cheese works. Likes the way it feels on his face. Cheeky tongue slip. 11/10 https://t.co/j1zczS0lI5,Cooper,,1.1,https://pbs.twimg.com/media/CWUZpydWcAAeipD.jpg,1,malamute,0.363257,True,Siberian_husky,0.0245862,True,Eskimo_dog,0.012554699999999998,True,1203,3015
1398,676957860086095872,2015-12-16 02:51:45,10/10 I'd follow this dog into battle no questions asked https://t.co/ngTNXYQF0L,,,1.0,https://pbs.twimg.com/ext_tw_video_thumb/676957802976419840/pu/img/dCj-qlXo73A5hf6Q.jpg,1,Labrador_retriever,0.772423,True,beagle,0.0055901699999999985,True,golden_retriever,0.00311519,True,907,2395
1399,676949632774234114,2015-12-16 02:19:04,This is Tyrus. He's a Speckled Centennial Ticonderoga. Terrified of floating red ball. Nifty bandana. 8/10 v petable https://t.co/HqM3YhCaaa,Tyrus,,0.8,https://pbs.twimg.com/media/CWUCGMtWEAAjXnS.jpg,1,Welsh_springer_spaniel,0.206479,True,Saint_Bernard,0.013933900000000003,True,boxer,0.0114606,True,448,1413
1400,676948236477857792,2015-12-16 02:13:31,This is Karl. Karl thinks he's slick. 6/10 sneaky pup https://t.co/Lo4ALwjVh4,Karl,,0.6,https://pbs.twimg.com/media/CWUA1GFW4AAowiq.jpg,1,guenon,0.611603,False,macaque,0.0135176,False,squirrel_monkey,0.00832473,False,980,2354
1401,676946864479084545,2015-12-16 02:08:04,This pups goal was to get all four feet as close to each other as possible. Valiant effort 12/10 https://t.co/2mXALbgBTV,,,1.2,https://pbs.twimg.com/media/CWT_lOQWUAAXPaY.jpg,1,Pekinese,0.752707,True,golden_retriever,0.005565459999999999,True,Great_Pyrenees,0.004101780000000001,True,426,1844
1402,676942428000112642,2015-12-16 01:50:26,Who leaves the last cupcake just sitting there? 9/10 https://t.co/PWMqAoEx2a,,,0.9,https://pbs.twimg.com/media/CWT7imQXIAMwpQ2.jpg,1,black-footed_ferret,0.707199,False,polecat,0.015463,False,weasel,0.00976255,False,855,2261
1403,676936541936185344,2015-12-16 01:27:03,Here we see a rare pouched pupper. Ample storage space. Looks alert. Jumps at random. Kicked open that door. 8/10 https://t.co/mqvaxleHRz,,pupper,0.8,https://pbs.twimg.com/media/CWT2MUgWIAECWig.jpg,1,Chesapeake_Bay_retriever,0.5452859999999999,True,Norwegian_elkhound,0.0081482,True,space_heater,0.0047391099999999995,False,5515,13809
1404,676897532954456065,2015-12-15 22:52:02,Exotic handheld dog here. Appears unathletic. Feet look deadly. Can be thrown a great distance. 5/10 might pet idk https://t.co/Avq4awulqk,,,0.5,https://pbs.twimg.com/media/CWTSt0UW4AALMNB.jpg,1,hamster,0.628255,False,guinea_pig,0.0318646,False,macaque,0.00130582,False,817,2426
1405,676864501615042560,2015-12-15 20:40:47,Meet Ash. He's just a head now. Lost his body during the Third Crusade. Still in good spirits. 10/10 would pet well https://t.co/NJj2uP0atK,Ash,,1.0,https://pbs.twimg.com/media/CWS0q8iU8AE2Srr.jpg,1,Chesapeake_Bay_retriever,0.371146,True,water_buffalo,0.00995963,False,Weimaraner,0.00489679,True,808,2294
1406,676821958043033607,2015-12-15 17:51:44,Finally some constructive political change in this country. 11/10 https://t.co/mvQaETHVSb,,,1.1,https://pbs.twimg.com/media/CWSN-vaXAAA8Ehr.jpg,2,Great_Pyrenees,0.8698040000000001,True,kuvasz,0.007981430000000001,True,standard_poodle,0.0013263,True,17605,25124
1407,676819651066732545,2015-12-15 17:42:34,Watch out Airbud. This pupper is also good at the sports. 12/10 I'm thinking D1 https://t.co/1HrFdo7M0C,,pupper,1.2,https://pbs.twimg.com/media/CWSL4W8WsAAE4KU.jpg,2,rain_barrel,0.625555,False,barrel,0.013838300000000001,False,Labrador_retriever,0.003946460000000001,True,741,1957
1408,676811746707918848,2015-12-15 17:11:09,Say hello to Penny &amp; Gizmo. They are practicing their caroling. The ambition in the room is tangible. 9/10 for both https://t.co/aqBHjjh5VD,Penny,,0.9,https://pbs.twimg.com/media/CWSEsO9WwAAX-fZ.jpg,1,Chihuahua,0.440916,True,Pomeranian,0.0345806,True,cocker_spaniel,0.00603312,True,469,1536
1409,676776431406465024,2015-12-15 14:50:49,"When someone yells ""cops!"" at a party and you gotta get your drunk friend out of there. 10/10 https://t.co/4rMZi5Ca1k",,,1.0,https://pbs.twimg.com/ext_tw_video_thumb/676776408941662209/pu/img/k-6I3YEZAQtYPBXR.jpg,1,doormat,0.201346,False,dishwasher,0.0191749,False,microwave,0.0038110000000000006,False,2249,5405
1410,676617503762681856,2015-12-15 04:19:18,I promise this wasn't meant to be a cuteness overload account but ermergerd look at this cozy pupper. 13/10 https://t.co/mpQl2rJjDh,,pupper,1.3,https://pbs.twimg.com/media/CWPUB9TWwAALPPx.jpg,1,Chihuahua,0.841084,True,Pomeranian,0.012053,True,Pekinese,0.000660034,True,1108,3149
1411,676613908052996102,2015-12-15 04:05:01,This is the saddest/sweetest/best picture I've been sent. 12/10 ðŸ˜¢ðŸ¶ https://t.co/vQ2Lw1BLBF,,,1.2,https://pbs.twimg.com/media/CWPQwmJWUAAu_At.jpg,1,book_jacket,0.49379,False,Doberman,0.00964228,True,miniature_pinscher,0.0070646699999999995,True,219,1183
1412,676606785097199616,2015-12-15 03:36:42,*screeches for a sec and then faints* 12/10 https://t.co/N5QL4ySBEx,,,1.2,https://pbs.twimg.com/media/CWPKSGpWcAQN6mw.jpg,1,Loafer,0.202999,False,doormat,0.0200411,False,malinois,0.014230000000000001,True,490,2039
1413,676603393314578432,2015-12-15 03:23:14,This is Godzilla pupper. He had a ruff childhood &amp; now deflects that pain outward by terrorizing cities. Tragic 9/10 https://t.co/g1tLGkyaxr,Godzilla,pupper,0.9,https://pbs.twimg.com/media/CWPHMqKVAAAE78E.jpg,1,whippet,0.8770209999999999,True,Great_Dane,0.00341819,True,boxer,0.0028404,True,440,1280
1414,676588346097852417,2015-12-15 02:23:26,This is Bubbles. He kinda resembles a fish. Always makes eye contact with u no matter what. Sneaky tongue slip. 5/10 https://t.co/Nrhvc5tLFT,Bubbles,,0.5,https://pbs.twimg.com/media/CWO5gmCUYAAX4WA.jpg,1,Boston_bull,0.976577,True,French_bulldog,0.00143237,True,Chihuahua,0.000230192,True,896,2533
1415,676582956622721024,2015-12-15 02:02:01,"Meet Vinnie. He's having fun while being safe. Well not a lot of fun, but definitely safe, and that's important 8/10 https://t.co/vZYtynZZlH",Vinnie,,0.8,https://pbs.twimg.com/media/CWO0m8tUwAAB901.jpg,1,seat_belt,0.790028,False,Boston_bull,0.0196307,True,French_bulldog,0.00124289,True,312,1310
1416,676575501977128964,2015-12-15 01:32:24,This pupper is very passionate about Christmas. Wanted to give the tree a hug. So cute. 8/10 https://t.co/NsGyECJuq7,,pupper,0.8,https://pbs.twimg.com/media/CWOt07EUsAAnOYW.jpg,1,feather_boa,0.424106,False,Yorkshire_terrier,0.007314429999999999,True,Shetland_sheepdog,0.00575976,True,1254,2807
1417,676533798876651520,2015-12-14 22:46:41,ITSOFLUFFAYYYYY 12/10 https://t.co/bfw13CnuuZ,,,1.2,https://pbs.twimg.com/media/CWOH4s9U8AEtkmQ.jpg,1,chow,0.26527399999999995,True,ice_bear,0.016761400000000003,False,fur_coat,0.0117506,False,621,2025
1418,676496375194980353,2015-12-14 20:17:59,Say hello to Griffin. He's upset because his costume for Halloween didn't arrive until today. 9/10 cheer up pup https://t.co/eoBCjSFajX,Griffin,,0.9,https://pbs.twimg.com/media/CWNl3S9WcAARN34.jpg,1,pug,0.985387,True,Norwegian_elkhound,0.00044168999999999995,True,French_bulldog,0.000389287,True,602,1641
1419,676470639084101634,2015-12-14 18:35:43,Three generations of pupper. 11/10 for all https://t.co/tAmQYvzrau,,pupper,1.1,https://pbs.twimg.com/media/CWNOdIpWoAAWid2.jpg,1,golden_retriever,0.7903859999999999,True,borzoi,0.0022885099999999997,True,dingo,0.00153434,False,5224,12616
1420,676440007570247681,2015-12-14 16:34:00,Hope your Monday isn't too awful. Here's two baseball puppers. 11/10 for each https://t.co/dB0H9hdZai,,pupper,1.1,https://pbs.twimg.com/media/CWMyl9EWUAAnZJ0.jpg,2,Maltese_dog,0.579472,True,toy_poodle,0.013344600000000002,True,Shih-Tzu,0.009439659999999999,True,748,1863
1421,676430933382295552,2015-12-14 15:57:56,"Meet Duke. He's an Urban Parmesan. They know he's scared of the green rubber dog. ""Why u do dis?"" thinks Duke. 10/10 https://t.co/3bim9U5Idr",Duke,,1.0,https://pbs.twimg.com/media/CWMqV7WUYAEEClG.jpg,1,golden_retriever,0.583875,True,cocker_spaniel,0.0203671,True,Labrador_retriever,0.00361217,True,385,1526
1422,676263575653122048,2015-12-14 04:52:55,All this pupper wanted to do was go skiing. No one told him about the El NiÃ±o. Poor pupper. 10/10 maybe next year https://t.co/fTgbq1UBR9,,pupper,1.0,https://pbs.twimg.com/media/CWKSIfUUYAAiOBO.jpg,1,teddy,0.0982826,False,toy_poodle,0.00980293,True,shopping_basket,0.007785210000000001,False,609,2243
1423,676237365392908289,2015-12-14 03:08:46,Say hello to Winston. He has no respect for the system. Much rebellion. I think that's a palm tree... nice. 8/10 https://t.co/dOLQddhXLZ,Winston,,0.8,https://pbs.twimg.com/media/CWJ6Sc-WwAAlpI6.jpg,1,French_bulldog,0.961996,True,Chihuahua,0.0021793,True,Boston_bull,0.000691629,True,331,1335
1424,676219687039057920,2015-12-14 01:58:31,This is Kenneth. He's stuck in a bubble. 10/10 hang in there Kenneth https://t.co/uQt37xlYMJ,Kenneth,,1.0,https://pbs.twimg.com/media/CWJqN9iWwAAg86R.jpg,1,bubble,0.997556,False,leafhopper,1.58961e-05,False,whippet,1.3246399999999999e-05,True,31989,67100
1425,676215927814406144,2015-12-14 01:43:35,This is Herm. He just wants to be like the other dogs. Sneaky tongue slip. Super fuzzy. 9/10 would cuddle firmly https://t.co/tg8h9lzCHv,Herm,,0.9,https://pbs.twimg.com/media/CWJmzNsWUAE706Z.jpg,1,hamster,0.999484,False,guinea_pig,1.58217e-05,False,broccoli,6.091100000000002e-06,False,661,1881
1426,676191832485810177,2015-12-14 00:07:50,These two pups just met and have instantly bonded. Spectacular scene. Mesmerizing af. 10/10 and 7/10 for blue dog https://t.co/gwryaJO4tC,,,1.0,https://pbs.twimg.com/media/CWJQ4UmWoAIJ29t.jpg,2,Chihuahua,0.376741,True,Italian_greyhound,0.0173114,True,muzzle,0.007148510000000001,False,1145,2478
1427,676146341966438401,2015-12-13 21:07:04,This is Bert. He likes flowers. 10/10 https://t.co/lmQRrNxaQu,Bert,,1.0,https://pbs.twimg.com/media/CWIngp5WEAAJOy3.jpg,1,Irish_water_spaniel,0.388332,True,standard_poodle,0.028412100000000003,True,greenhouse,0.00348681,False,744,2077
1428,676101918813499392,2015-12-13 18:10:33,Meet Striker. He's ready for Christmas. 11/10 https://t.co/B3xxSLjQSH,Striker,,1.1,https://pbs.twimg.com/media/CWH_FTgWIAAwOUy.jpg,1,Shih-Tzu,0.225848,True,Norfolk_terrier,0.0186873,True,Irish_terrier,0.010698699999999997,True,1284,3042
1429,676098748976615425,2015-12-13 17:57:57,Extremely rare pup here. Very religious. Always praying. Too many legs. Not overwhelmingly fluffy. Won't bark. 3/10 https://t.co/REyE5YKVBb,,,0.3,https://pbs.twimg.com/media/CWH8L72UkAAvjql.jpg,1,walking_stick,0.162179,False,sandal,0.012908599999999998,False,purse,0.00814119,False,1623,3279
1430,676089483918516224,2015-12-13 17:21:08,"""Yes hello I'ma just snag this here toasted bagel real quick. carry on."" 9/10 https://t.co/Cuz0Osnekp",,,0.9,https://pbs.twimg.com/media/CWHzzFGXIAA0Y_H.jpg,1,bull_mastiff,0.743808,True,boxer,0.0106697,True,American_Staffordshire_terrier,0.00423353,True,483,1431
1431,675898130735476737,2015-12-13 04:40:46,I'm sure you've all seen this pupper. Not prepared at all for the flying disc of terror. 10/10 https://t.co/G0pQiFGM7O,,pupper,1.0,https://pbs.twimg.com/media/CWFFt3_XIAArIYK.jpg,1,Labrador_retriever,0.40743,True,malinois,0.00770367,True,pug,0.00745973,True,653,1774
1432,675891555769696257,2015-12-13 04:14:39,This is Donny. He's summoning the demon monster Babadook. 6/10 Donny please no that won't be a good time for anyone https://t.co/kiW6Knb7Gp,Donny,,0.6,https://pbs.twimg.com/media/CWE_x33UwAEE3no.jpg,1,Italian_greyhound,0.305637,True,whippet,0.023205700000000003,True,Great_Dane,0.011780599999999999,True,976,2297
1433,675888385639251968,2015-12-13 04:02:03,Breathtaking scene. A father taking care of his newborn pup. Tugs at the heartstrings. 10/10 restores my faith https://t.co/06oZdehGEa,,,1.0,https://pbs.twimg.com/media/CWE85snWIAEG5ES.jpg,1,West_Highland_white_terrier,0.672117,True,Old_English_sheepdog,0.0146147,True,komondor,0.00231414,True,1067,2581
1434,675878199931371520,2015-12-13 03:21:34,"Ok, I'll admit this is a pretty adorable bunny hopping towards the ocean but please only send in dogs... 11/10 https://t.co/sfsVCGIipI",,,1.1,https://pbs.twimg.com/media/CWEzo19WoAEiOCj.jpg,1,wood_rabbit,0.785756,False,hare,0.0118181,False,Cardigan,0.0043627100000000005,True,1570,4531
1435,675870721063669760,2015-12-13 02:51:51,&amp; this is Yoshi. Another world record contender 11/10 (what the hell is happening why are there so many contenders?) https://t.co/QG708dDNH6,,,1.1,https://pbs.twimg.com/media/CWEs1b-WEAEhq82.jpg,1,golden_retriever,0.263892,True,Welsh_springer_spaniel,0.0184193,True,beagle,0.0182241,True,632,1783
1436,675853064436391936,2015-12-13 01:41:41,Here we have an entire platoon of puppers. Total score: 88/80 would pet all at once https://t.co/y93p6FLvVw,,pupper,1.1,https://pbs.twimg.com/media/CWEcxqWVEAAHyGH.jpg,1,Labrador_retriever,0.868367,True,golden_retriever,0.0043304599999999995,True,vizsla,0.00282072,True,1460,2927
1437,675845657354215424,2015-12-13 01:12:15,"This is Pepper. She's not fully comfortable riding her imaginary bike yet. 10/10 don't worry pupper, it gets easier https://t.co/40dj4eTsXG",Pepper,pupper,1.0,https://pbs.twimg.com/media/CWEWClfW4AAnqhG.jpg,1,pug,0.8839520000000001,True,Boston_bull,0.00110568,True,French_bulldog,0.0009839809999999999,True,1000,2477
1438,675822767435051008,2015-12-12 23:41:18,ðŸŽ¶ HELLO FROM THE OTHER SIIIIIIIIDE ðŸŽ¶ 10/10s https://t.co/GK2HJtkdQk,,,1.0,https://pbs.twimg.com/media/CWEBOFYWwAA-O2c.jpg,1,Pomeranian,0.4607100000000001,True,chow,0.0202765,True,Pekinese,0.0133266,True,591,1652
1439,675820929667219457,2015-12-12 23:34:00,Here's a handful of sleepy puppers. All look unaware of their surroundings. Lousy guard dogs. Still cute tho 11/10s https://t.co/lyXX3v5j4s,,pupper,1.1,https://pbs.twimg.com/media/CWD_jQMWEAAdYwH.jpg,1,basset,0.556373,True,beagle,0.020167499999999998,True,bloodhound,0.0110848,True,260,1140
1440,675798442703122432,2015-12-12 22:04:39,This is Bernie. He just touched a boob for the first time. 10/10 https://t.co/whQKMygnK6,Bernie,,1.0,https://pbs.twimg.com/media/CWDrGH4UYAARoq_.jpg,1,beagle,0.681218,True,basset,0.012512100000000002,True,boxer,0.00803982,True,3787,11101
1441,675781562965868544,2015-12-12 20:57:34,Say hello to Buddah. He was Waldo for Halloween. 11/10 https://t.co/DVAqAnb624,Buddah,,1.1,https://pbs.twimg.com/media/CWDbv2yU4AARfeH.jpg,1,Maltese_dog,0.921968,True,West_Highland_white_terrier,0.0017810699999999998,True,toy_poodle,0.0013555400000000001,True,537,1750
1442,675740360753160193,2015-12-12 18:13:51,Here's a pupper licking in slow motion. 12/10 please enjoy https://t.co/AUJi8ujxw9,,pupper,1.2,https://pbs.twimg.com/ext_tw_video_thumb/675740268751138818/pu/img/dVaVeFAVT-lk_1ZV.jpg,1,golden_retriever,0.800495,True,kuvasz,0.009775639999999999,True,Saluki,0.006841460000000001,True,388,1257
1443,675710890956750848,2015-12-12 16:16:45,This is Lenny. He was just told that he couldn't explore the fish tank. 12/10 smh all that work for nothing https://t.co/JWi6YrpiO1,Lenny,,1.2,https://pbs.twimg.com/media/CWCbd8ZWoAAtqoH.jpg,2,standard_schnauzer,0.4414270000000001,True,miniature_schnauzer,0.0248885,True,Sealyham_terrier,0.0164967,True,928,2046
1444,675707330206547968,2015-12-12 16:02:36,We've got ourselves a battle here. Watch out Reggie. 11/10 https://t.co/ALJvbtcwf0,,,1.1,https://pbs.twimg.com/media/CWCYOqWUAAARmGr.jpg,1,bath_towel,0.721933,False,Staffordshire_bullterrier,0.00593442,True,bagel,0.0035701599999999984,False,771,2154
1445,675706639471788032,2015-12-12 15:59:51,This is a Sizzlin Menorah spaniel from Brooklyn named Wylie. Lovable eyes. Chiller as hell. 10/10 and I'm out.. poof https://t.co/7E0AiJXPmI,,,1.0,https://pbs.twimg.com/media/CWCXj35VEAIFvtk.jpg,1,English_springer,0.9903,True,Welsh_springer_spaniel,0.00020799099999999998,True,cocker_spaniel,0.00020137800000000002,True,106,693
1446,675534494439489536,2015-12-12 04:35:48,Seriously guys?! Only send in dogs. I only rate dogs. This is a baby black bear... 11/10 https://t.co/H7kpabTfLj,,,1.1,https://pbs.twimg.com/media/CV_7CV6XIAEV05u.jpg,1,chow,0.749368,True,schipperke,0.013373800000000002,True,Newfoundland,0.00499138,True,470,1953
1447,675531475945709568,2015-12-12 04:23:49,This is Ellie AKA Queen Slayer of the Orbs. Very self-motivated. Great yard. Rad foliage. 10/10 would pet diligently https://t.co/c9jmg3Xtzn,Ellie,,1.0,https://pbs.twimg.com/media/CV_4ShmUYAA3wNu.jpg,1,Pembroke,0.918441,True,Cardigan,0.0027339499999999997,True,Siberian_husky,0.0020220999999999998,True,428,1276
1448,675522403582218240,2015-12-12 03:47:46,Meet Sammy. He's a Motorola Firefox. Hat under hoodie (must be a half-decent up and coming white rapper) 10/10 https://t.co/rO2zxf0OQ0,Sammy,,1.0,https://pbs.twimg.com/media/CV_wCh8W4AEWWZ9.jpg,1,cocker_spaniel,0.299708,True,golden_retriever,0.026366499999999998,True,Irish_setter,0.00803233,True,316,1122
1449,675517828909424640,2015-12-12 03:29:35,12/10 stay woke https://t.co/XDiQw4Akiw,,,1.2,https://pbs.twimg.com/media/CV_r3v4VAAALvwg.jpg,1,Scottish_deerhound,0.240591,True,groenendael,0.0156916,True,flat-coated_retriever,0.009089940000000001,True,507,1414
1450,675497103322386432,2015-12-12 02:07:14,Meet Reggie. He's going for the world record. Must concentrate. Focus up pup. 11/10 we all believe in you Reggie https://t.co/h3AWz4AzuC,Reggie,,1.1,https://pbs.twimg.com/media/CV_ZAhcUkAUeKtZ.jpg,1,vizsla,0.5195890000000001,True,miniature_pinscher,0.00647712,True,Rhodesian_ridgeback,0.00614913,True,1443,3397
1451,675489971617296384,2015-12-12 01:38:53,RT until we find this dog. Clearly a cool dog (front leg relaxed out window). Looks to be a superb driver. 10/10 https://t.co/MnTrKaQ8Wn,,,1.0,https://pbs.twimg.com/media/CV_SimUWoAAvJSY.jpg,1,West_Highland_white_terrier,0.139613,True,seat_belt,0.0118647,False,Old_English_sheepdog,0.00939522,True,672,1406
1452,675483430902214656,2015-12-12 01:12:54,Rare shielded battle dog here. Very happy about abundance of lettuce. Painfully slow fetcher. Still petable. 5/10 https://t.co/C3tlKVq7eO,,,0.5,https://pbs.twimg.com/media/CV_MmGZU8AAggM6.jpg,1,box_turtle,0.543706,False,terrapin,0.02026,False,loggerhead,0.00711215,False,1081,1985
1453,675432746517426176,2015-12-11 21:51:30,Happy Friday. Here's some golden puppers. 12/10 for all https://t.co/wNkqAED6lG,,pupper,1.2,https://pbs.twimg.com/media/CV-ef64WoAAbh0I.jpg,1,Labrador_retriever,0.986548,True,golden_retriever,0.000886185,True,Chihuahua,6.93528e-05,True,627,1623
1454,675372240448454658,2015-12-11 17:51:04,"The tail alone is 13/10. Great dog, better owner https://t.co/IyAXinfyju",,,1.3,https://pbs.twimg.com/media/CV9nd30XAAAEba5.jpg,1,Chihuahua,0.4163850000000001,True,West_Highland_white_terrier,0.0102933,True,Samoyed,0.00872995,True,563,1838
1455,675362609739206656,2015-12-11 17:12:48,This is Daisy. She loves that shoe. Still no seat belt. Super churlish. 12/10 the dogs are killing it today https://t.co/cZlkvgRPdn,Daisy,,1.2,https://pbs.twimg.com/media/CV9etctWUAAl5Hp.jpg,1,Labrador_retriever,0.479008,True,ice_bear,0.021828900000000002,False,kuvasz,0.013991099999999998,True,262,1136
1456,675349384339542016,2015-12-11 16:20:15,Yea I lied. Here's more. All 13/10 https://t.co/ZQZf2U4xCP,,,1.3,https://pbs.twimg.com/media/CV9SrABU4AQI46z.jpg,3,borzoi,0.866367,True,Saluki,0.012207899999999999,True,Irish_wolfhound,0.000401972,True,2532,4237
1457,675334060156301312,2015-12-11 15:19:21,Good morning here's a grass pupper. 12/10 https://t.co/2d68FmWGGs,,pupper,1.2,https://pbs.twimg.com/media/CV9EvZNUwAAgLCK.jpg,2,Pembroke,0.773135,True,Cardigan,0.011681,True,chow,0.00390362,True,1436,3007
1458,675166823650848770,2015-12-11 04:14:49,This is Arnold. He broke his leg saving a handicapped child from a forest fire. True hero. 10/10 inspirational dog https://t.co/bijCeHeX4C,Arnold,,1.0,https://pbs.twimg.com/media/CV6spB7XAAIpMyP.jpg,1,llama,0.284394,False,standard_poodle,0.013256899999999999,True,teddy,0.0127975,False,1795,3920
1459,675153376133427200,2015-12-11 03:21:23,What kind of person sends in a picture without a dog in it? 1/10 just because that's a nice table https://t.co/RDXCfk8hK0,,,0.1,https://pbs.twimg.com/media/CV6gaUUWEAAnETq.jpg,1,paper_towel,0.327957,False,mailbox,0.009602689999999997,False,seat_belt,0.0034995099999999995,False,2734,6072
