,tweet_id,timestamp,text,name,stages,rating,jpg_url,img_num,p1,p1_conf,p1_dog,p2,p2_conf,p2_dog,p3,p3_conf,p3_dog,retweet_count,favourite_count
440,793601777308463104,2016-11-01 23:53:02,This is Dobby. I can't stop looking at her feet. 12/10 would absolutely snug https://t.co/LhzPWv6rTv,Dobby,,1.2,https://pbs.twimg.com/media/CwNwmxvXEAEJ54Z.jpg,1,miniature_pinscher,0.538981,True,Chihuahua,0.021783,True,toy_terrier,0.00891487,True,1908,8926
441,793500921481273345,2016-11-01 17:12:16,This is Fiona. She's an extremely mediocre copilot. Very distracting. Wink makes up for all the missed turns. 12/10 https://t.co/aF5MmpvPqN,Fiona,,1.2,https://pbs.twimg.com/media/CwMU34YWIAAz1nU.jpg,2,golden_retriever,0.326122,True,Labrador_retriever,0.0219904,True,Chesapeake_Bay_retriever,0.0163366,True,2786,11953
442,793271401113350145,2016-11-01 02:00:14,Meet Dave. It's his favorite day of the year. He gets to fulfill his dream of being a dinosaur. 12/10 inspirational af https://t.co/MgQSdfZGPN,Dave,,1.2,https://pbs.twimg.com/media/CwJEIKTWYAAvL-T.jpg,1,Siberian_husky,0.231695,True,Eskimo_dog,0.0206749,True,Pembroke,0.00701195,True,2763,9677
443,793256262322548741,2016-11-01 01:00:05,Oh h*ck look at this spookling right here. Fright level off the charts. 12/10 sufficiently spooked https://t.co/BNy9IIJMb0,,,1.2,https://pbs.twimg.com/media/CwI2XCvXEAEO8mc.jpg,1,basset,0.207622,True,Walker_hound,0.00605742,True,beagle,0.00412205,True,9714,22350
444,793241302385262592,2016-11-01 00:00:38,This is Tucker. He's out here bustin h*ckin ghosts. 13/10 dedicated af https://t.co/Ap477GhwXt,Tucker,,1.3,https://pbs.twimg.com/media/CwIougTWcAAMLyq.jpg,1,golden_retriever,0.559308,True,Labrador_retriever,0.0390222,True,cocker_spaniel,0.0036315699999999998,True,3812,11780
445,793226087023144960,2016-10-31 23:00:11,"This is Juno. She spooked me up real good, but only to get my attention. Above average handwriting for a dog I think. 11/10 https://t.co/hFxxBCWlwj",Juno,,1.1,https://pbs.twimg.com/media/CwIa5CjW8AErZgL.jpg,1,wire-haired_fox_terrier,0.456047,True,Lakeland_terrier,0.0273428,True,English_springer,0.00836433,True,3338,11001
446,793210959003287553,2016-10-31 22:00:04,This is Maude. She's the h*ckin happiest wasp you've ever seen. 10/10 would pet with caution https://t.co/etL8FHBrh8,Maude,,1.0,https://pbs.twimg.com/media/CwINKJeW8AYHVkn.jpg,1,doormat,0.874431,False,French_bulldog,0.0018759100000000002,True,Boston_bull,0.00151344,True,3301,9997
447,793195938047070209,2016-10-31 21:00:23,Say hello to Lily. She's pupset that her costume doesn't fit as well as last year. 12/10 poor puppo https://t.co/YSi6K1firY,Lily,puppo,1.2,https://pbs.twimg.com/media/CwH_foYWgAEvTyI.jpg,2,Labrador_retriever,0.654762,True,golden_retriever,0.00741,True,Chihuahua,0.00423393,True,6547,17063
448,793180763617361921,2016-10-31 20:00:05,This is Newt. He's a strawberry. 11/10 https://t.co/2VhmlwxA1Q,Newt,,1.1,https://pbs.twimg.com/media/CwHxsdYVMAAqGCJ.jpg,1,Lakeland_terrier,0.266824,True,Irish_terrier,0.0218783,True,Airedale,0.013295999999999999,True,2310,7740
449,793165685325201412,2016-10-31 19:00:10,This is Benji. He's Air Bud. It's a low effort costume but he pulls it off rather h*ckin well. 12/10 would happily get dunked on https://t.co/IbzT7DJvBo,Benji,,1.2,https://pbs.twimg.com/media/CwHj-jGWAAAnsny.jpg,1,golden_retriever,0.946224,True,Labrador_retriever,0.0036476599999999996,True,doormat,0.000235285,False,3238,10478
450,793150605191548928,2016-10-31 18:00:14,This is Nida. She's a free elf. Waited so long for this day. 11/10 https://t.co/3lE8Izgmkf,Nida,,1.1,https://pbs.twimg.com/media/CwHWOZ7W8AAHv8S.jpg,1,Italian_greyhound,0.193869,True,bluetick,0.016038,True,standard_poodle,0.012598199999999999,True,1984,6909
451,793135492858580992,2016-10-31 17:00:11,Your favorite squad is looking extra h*ckin spooky today. 13/10 for all https://t.co/PrgvOyPtDT,,,1.3,https://pbs.twimg.com/media/CwHIg61WIAApnEV.jpg,1,bakery,0.737041,False,saltshaker,0.005239590000000001,False,teddy,0.00465926,False,2893,7214
452,793120401413079041,2016-10-31 16:00:13,"This is Robin. She's desperately trying to do me a frighten, but her tongue drastically decreases her spook value. Still 11/10 great effort https://t.co/sxMrsOZ8zb",Robin,,1.1,https://pbs.twimg.com/media/CwG6zDfWcAA8jBD.jpg,1,Labrador_retriever,0.7249439999999999,True,golden_retriever,0.0169744,True,kuvasz,0.00355023,True,4551,14202
453,792913359805018113,2016-10-31 02:17:31,Here is a perfect example of someone who has their priorities in order. 13/10 for both owner and Forrest https://t.co/LRyMrU7Wfq,,,1.3,https://pbs.twimg.com/media/CwD-eCLWIAA6v0B.jpg,4,web_site,0.226716,False,lighter,0.008194139999999999,False,switch,0.00390086,False,4715,16063
454,792883833364439040,2016-10-31 00:20:11,This is Bailey. She's rather h*ckin hype for Halloween tomorrow. Carved those pupkins herself. 12/10 https://t.co/v17mFm0Ftz,Bailey,,1.2,https://pbs.twimg.com/media/CwDjoH3WAAIniIs.jpg,3,jack-o'-lantern,0.999306,False,basketball,1.13129e-05,False,standard_poodle,8.31451e-06,True,4964,12666
455,792773781206999040,2016-10-30 17:02:53,This is Monster. Not an actual monster tho. He's showing you his tongue. Very impressive Monster. 12/10 would snug https://t.co/RhaPExuxJL,Monster,,1.2,https://pbs.twimg.com/media/CwB_i-zXEAEiP29.jpg,1,Yorkshire_terrier,0.912804,True,silky_terrier,0.006782250000000001,True,Australian_terrier,0.00044506900000000003,True,1963,8209
456,792394556390137856,2016-10-29 15:55:58,Meet BeBe. She rocks the messy bun of your dreams. H*ckin flawless. 12/10 would watch her tutorial https://t.co/of0pFNBIl8,BeBe,,1.2,https://pbs.twimg.com/media/Cv8moW9W8AIHOxR.jpg,2,cocker_spaniel,0.746387,True,Irish_setter,0.009161510000000001,True,miniature_poodle,0.006107819999999998,True,4998,15128
457,792050063153438720,2016-10-28 17:07:05,This is Remus. He's a mop that came to life. Can't see anything. Constantly trips over himself. Still a very good dog. 11/10 https://t.co/S3f1SYylzu,Remus,,1.1,https://pbs.twimg.com/media/Cv3tU38WcAASFas.jpg,2,komondor,0.942856,True,swab,0.005271519999999999,False,Tibetan_terrier,0.0002743,True,2088,8029
458,791406955684368384,2016-10-26 22:31:36,Say hello to Levi. He's a Madagascan Butterbop. One of the more docile Butterbops I've seen. 12/10 would give all the pets https://t.co/Zcw9Sccctc,Levi,,1.2,https://pbs.twimg.com/media/CvukbEkWAAAV-69.jpg,4,Pembroke,0.972629,True,Cardigan,0.00270259,True,basenji,1.52502e-05,True,4797,14670
459,791312159183634433,2016-10-26 16:14:55,This is Mabel. She's super h*ckin smol. Portable af. Comes with the smol shoe. 12/10 would keep in frocket https://t.co/GGJvxYt3xK,Mabel,,1.2,https://pbs.twimg.com/media/CvtONV4WAAAQ3Rn.jpg,4,miniature_pinscher,0.892925,True,toy_terrier,0.009552380000000001,True,Doberman,0.000354426,True,2963,9841
460,790987426131050500,2016-10-25 18:44:32,This is Misty. She has a cowboy hat on her nose. 12/10 https://t.co/Eno0mypHIr,Misty,,1.2,https://pbs.twimg.com/media/Cvom3ZJXEAE29TD.jpg,1,cocker_spaniel,0.349195,True,flat-coated_retriever,0.030953500000000002,True,Newfoundland,0.0104768,True,2483,11089
461,790698755171364864,2016-10-24 23:37:28,This is Mosby. He appears to be rather h*ckin snuggable af. 12/10 keep it up Mosby https://t.co/IiiBq460I7,Mosby,,1.2,https://pbs.twimg.com/media/CvkgUjbUsAEvo7l.jpg,1,Bernese_mountain_dog,0.996541,True,EntleBucher,0.00010569799999999999,True,Appenzeller,9.979069999999999e-05,True,2203,9158
462,790581949425475584,2016-10-24 15:53:19,This is Duke. He sneaks into the fridge sometimes. It's his safe place. 11/10 would give little jacket if necessary https://t.co/Fd5WFDTMH4,Duke,,1.1,https://pbs.twimg.com/media/Cvi2FiKWgAAif1u.jpg,2,refrigerator,0.998886,False,malinois,1.52999e-05,True,kelpie,1.30817e-05,True,8183,22473
463,790337589677002753,2016-10-23 23:42:19,Meet Maggie. She can hear your cells divide. 12/10 can also probably fly https://t.co/ovE2hqXryV,Maggie,,1.2,https://pbs.twimg.com/media/CvfX2AnWYAAQTay.jpg,1,Pembroke,0.658808,True,Cardigan,0.015309600000000001,True,toy_terrier,0.0102299,True,2167,8740
464,789628658055020548,2016-10-22 00:45:17,This is Eli. He can fly. 13/10 magical af https://t.co/huPSJJ7FDI,Eli,,1.3,https://pbs.twimg.com/media/CvVTEnPXYAAWLyL.jpg,1,chow,0.260702,True,cougar,0.00881427,False,Pomeranian,0.00798831,True,2080,8448
465,789599242079838210,2016-10-21 22:48:24,This is Brownie. She's wearing a Halloween themed onesie. 12/10 festive af https://t.co/0R4meWXFOx,Brownie,,1.2,https://pbs.twimg.com/media/CvU4UZpXgAE1pAV.jpg,2,Chesapeake_Bay_retriever,0.8788219999999999,True,beagle,0.0018570300000000002,True,Labrador_retriever,0.00174985,True,2279,7620
466,789268448748703744,2016-10-21 00:53:56,This is Stella. She's happier than I will ever be. 10/10 would trade lives with https://t.co/JSs2bfDtTS,Stella,,1.0,https://pbs.twimg.com/media/CvQLdotWcAAZn86.jpg,1,malamute,0.81286,True,Siberian_husky,0.0120853,True,Eskimo_dog,0.00242693,True,3014,10196
467,789137962068021249,2016-10-20 16:15:26,This is Bo. He's a West Congolese Bugaboop Snuggle. Rather exotic. Master of the head tilt. 12/10 would pay to pet https://t.co/2jwxxtNzoN,Bo,,1.2,https://pbs.twimg.com/media/CvOUw8vWYAAzJDq.jpg,2,Chihuahua,0.746135,True,Pekinese,0.00703834,True,Pembroke,0.00492369,True,3244,10875
468,788908386943430656,2016-10-20 01:03:11,"This is Lucy. She destroyed not one, but two remotes trying to turn off the debate. 11/10 relatable af https://t.co/3BXh073tDm",Lucy,,1.1,https://pbs.twimg.com/media/CvLD-mbWYAAFI8w.jpg,1,remote_control,0.8815379999999999,False,oscilloscope,0.00355131,False,golden_retriever,0.00340897,True,14409,30653
469,788412144018661376,2016-10-18 16:11:17,This is Dexter. He breaks hearts for a living. 11/10 h*ckin handsome af https://t.co/4DhSsC1W7S,Dexter,,1.1,https://pbs.twimg.com/media/CvEAqQoWgAADj5K.jpg,1,golden_retriever,0.805238,True,Labrador_retriever,0.011379799999999999,True,Brittany_spaniel,0.00385587,True,5990,16060
470,788178268662984705,2016-10-18 00:41:57,Atlas is back and this time he's got doggles. Still 13/10 solarly conscious af https://t.co/s7MgFWDySc,,,1.3,https://pbs.twimg.com/media/CvAr88kW8AEKNAO.jpg,2,Samoyed,0.73548,True,Pomeranian,0.0075101000000000005,True,Arctic_fox,0.0036071899999999997,False,2488,8100
471,788150585577050112,2016-10-17 22:51:57,This is Leo. He's a golden chow. Rather h*ckin rare. 13/10 would give extra pats https://t.co/xosHjFzVXc,Leo,,1.3,https://pbs.twimg.com/media/CvASw6dWcAQmo3X.jpg,3,chow,0.814145,True,Pomeranian,0.0112704,True,Chihuahua,0.00158832,True,1510,6865
472,788039637453406209,2016-10-17 15:31:05,Did... did they pick out that license plate? 12/10 for both https://t.co/lRmUUOxgbQ,,,1.2,https://pbs.twimg.com/media/Cu-t20yWEAAFHXi.jpg,1,beach_wagon,0.362925,False,minivan,0.0304759,False,limousine,0.0101702,False,1535,6867
473,787810552592695296,2016-10-17 00:20:47,This is Frank. He wears sunglasses and walks himself. 11/10 I'll never be this cool or independent https://t.co/pNNjBtHWPc,Frank,,1.1,https://pbs.twimg.com/media/Cu7dg2RXYAIaGXE.jpg,2,pug,0.362835,True,French_bulldog,0.022186400000000002,True,English_setter,0.00804183,True,3540,9717
474,787717603741622272,2016-10-16 18:11:26,This is Tonks. She is a service puppo. Can hear a caterpillar hiccup from 7 miles away. 13/10 would follow anywhere https://t.co/i622ZbWkUp,Tonks,puppo,1.3,https://pbs.twimg.com/media/Cu6I9vvWIAAZG0a.jpg,3,German_shepherd,0.992339,True,malinois,0.000492039,True,kelpie,8.52802e-05,True,3240,11416
475,787397959788929025,2016-10-15 21:01:17,This is Moose. He's rather h*ckin dangerous (you can tell by the collar). 11/10 would still attempt to snug https://t.co/lHVHGdDzb3,Moose,,1.1,https://pbs.twimg.com/media/Cu1mQsDWEAAU_VQ.jpg,1,Chihuahua,0.900483,True,toy_terrier,0.00210845,True,miniature_pinscher,0.0019484,True,3300,12120
476,787322443945877504,2016-10-15 16:01:13,This is Lincoln. He forgot to use his blinker when he changed lanes just now. Guilty as h*ck. Still 10/10 https://t.co/lsrR83SiVp,Lincoln,,1.0,https://pbs.twimg.com/media/Cu0hlfwWYAEdnXO.jpg,1,seat_belt,0.747739,False,golden_retriever,0.010570300000000001,True,dingo,0.0017256799999999998,False,2032,8726
477,786963064373534720,2016-10-14 16:13:10,This is Rory. He's got an interview in a few minutes. Looking spiffy af. Nervous as h*ck tho. 12/10 would hire https://t.co/ibj5g6xaAj,Rory,,1.2,https://pbs.twimg.com/media/Cuvau3MW8AAxaRv.jpg,1,golden_retriever,0.915303,True,Saluki,0.00462126,True,Labrador_retriever,0.00375041,True,9327,29725
478,786709082849828864,2016-10-13 23:23:56,"This is Logan, the Chow who lived. He solemnly swears he's up to lots of good. H*ckin magical af 9.75/10 https://t.co/yBO5wuqaPS",Logan,,7.5,https://pbs.twimg.com/media/CurzvFTXgAA2_AP.jpg,1,Pomeranian,0.467321,True,Persian_cat,0.012297800000000001,False,chow,0.0102654,True,7069,20296
479,786664955043049472,2016-10-13 20:28:35,"""Honestly Kathleen I just want more Ken Bone"" 12/10 https://t.co/HmlEvAMP4r",,,1.2,https://pbs.twimg.com/media/CurLmoqXgAEPoJ-.jpg,1,Leonberg,0.512034,True,keeshond,0.0464816,True,Pomeranian,0.000781249,True,2996,11957
480,786595970293370880,2016-10-13 15:54:28,This is Dale. He's a real spookster. Did me quite the frighten. 11/10 not too spooky to pet tho https://t.co/L8BWDD4oBX,Dale,,1.1,https://pbs.twimg.com/media/CuqM0fVWAAAboKR.jpg,1,Pembroke,0.709512,True,Cardigan,0.028717800000000005,True,chow,5.70176e-05,True,3601,10497
481,786363235746385920,2016-10-13 00:29:39,This is Rizzo. He has many talents. A true renaissance doggo. 13/10 entertaining af https://t.co/TVXpEJB7Wn,Rizzo,doggo,1.3,https://pbs.twimg.com/media/Cum5LlfWAAAyPcS.jpg,1,golden_retriever,0.929266,True,Labrador_retriever,0.006286669999999999,True,Saluki,0.000215669,True,4072,12189
482,786233965241827333,2016-10-12 15:55:59,This is Mattie. She's extremely dangerous. Will bite your h*ckin finger right off. Still 11/10 would pet with caution https://t.co/78c9W8kLFh,Mattie,,1.1,https://pbs.twimg.com/media/CulDnZpWcAAGbZ-.jpg,1,Labrador_retriever,0.478193,True,schipperke,0.0224817,True,Staffordshire_bullterrier,0.0077395599999999995,True,5571,17178
483,785927819176054784,2016-10-11 19:39:28,This is Lucy. She's strives to be the best potato she can be. 12/10 would boop https://t.co/lntsj7Fc4Y,Lucy,,1.2,https://pbs.twimg.com/media/CugtKeXWEAAamDZ.jpg,1,teddy,0.97207,False,toy_poodle,0.0008492619999999999,True,chow,0.000288271,True,3652,12696
484,785872687017132033,2016-10-11 16:00:24,Meet Rusty. He appears to be rather h*ckin fluffy. Also downright adorable af. 12/10 would rub my face against his https://t.co/1j9kLGb4wV,Rusty,,1.2,https://pbs.twimg.com/ext_tw_video_thumb/785872596088811520/pu/img/5O-_BgqdFQu_2Bt7.jpg,1,Great_Pyrenees,0.392108,True,golden_retriever,0.0198358,True,Pekinese,0.014332800000000001,True,2130,7489
485,785639753186217984,2016-10-11 00:34:48,This is Pinot. He's a sophisticated doggo. You can tell by the hat. Also pointier than your average pupper. Still 10/10 would pet cautiously https://t.co/f2wmLZTPHd,Pinot,doggo,1.0,https://pbs.twimg.com/media/CucnLmeWAAALOSC.jpg,1,porcupine,0.978042,False,sea_urchin,0.00061063,False,echidna,0.000544197,False,2561,8735
486,785533386513321988,2016-10-10 17:32:08,This is Dallas. Her tongue is ridiculous. 11/10 h*ckin proud af https://t.co/h4jhlH4EyG,Dallas,,1.1,https://pbs.twimg.com/media/CubGchjXEAA6gpw.jpg,2,miniature_pinscher,0.436023,True,black-and-tan_coonhound,0.0258049,True,Rottweiler,0.0145231,True,2334,10183
487,785264754247995392,2016-10-09 23:44:41,This is Doc. He requested to be carried around like that. 12/10 anything for Doc https://t.co/mWYACm4qnx,Doc,,1.2,https://pbs.twimg.com/media/CuXSHNnWcAIWEwn.jpg,1,teddy,0.6748930000000001,False,cradle,0.0056739600000000005,False,chow,0.0056137,True,1911,8128
488,785170936622350336,2016-10-09 17:31:53,This is Hero. He was enjoying the car ride until he remembered that bees are dying globally at an alarming rate. 11/10 https://t.co/cubFg7F4qQ,Hero,,1.1,https://pbs.twimg.com/media/CuV8yfxXEAAUlye.jpg,2,seat_belt,0.891193,False,Eskimo_dog,0.0027494399999999997,True,Samoyed,0.0019530300000000001,True,5639,13491
489,784517518371221505,2016-10-07 22:15:26,This is Frankie. He has yet to learn how to control his tongue. 11/10 maybe one day https://t.co/p6fgYe2dB6,Frankie,,1.1,https://pbs.twimg.com/media/CuMqhGrXYAQwRqU.jpg,2,malamute,0.757764,True,Eskimo_dog,0.015124799999999999,True,Siberian_husky,0.008484019999999998,True,2970,10039
490,784431430411685888,2016-10-07 16:33:21,This is Stormy. He's curly af. Already pupared for Coachella next year. 12/10 https://t.co/PHA1vtqqpt,Stormy,,1.2,https://pbs.twimg.com/media/CuLcNkCXgAEIwK2.jpg,1,miniature_poodle,0.744819,True,toy_poodle,0.0243192,True,standard_poodle,0.00109202,True,1491,6329
491,783839966405230592,2016-10-06 01:23:05,This is Riley. His owner put a donut pillow around him and he loves it so much he won't let anyone take it off. 13/10 https://t.co/8TCQcsZCZ8,Riley,,1.3,https://pbs.twimg.com/media/CuDCSM-XEAAJw1W.jpg,1,quilt,0.333739,False,Siamese_cat,0.013624500000000001,False,three-toed_sloth,0.0117464,False,12643,33689
492,783821107061198850,2016-10-06 00:08:09,This is Mairi. She has mastered the art of camouflage. 12/10 h*ckin sneaky af https://t.co/STcPjiNAHp,Mairi,,1.2,https://pbs.twimg.com/media/CuCxIzyWEAQTnQA.jpg,1,Lakeland_terrier,0.26565900000000003,True,golden_retriever,0.0196414,True,standard_poodle,0.013353400000000001,True,2269,8209
493,783695101801398276,2016-10-05 15:47:27,This is Loomis. He's the leader of the Kenneth search party. The passion is almost overwhelming. 12/10 one day he will be free https://t.co/kCRKlFg4AY,Loomis,,1.2,https://pbs.twimg.com/media/CuA-iRHXYAAWP8e.jpg,3,chow,0.314265,True,golden_retriever,0.0300435,True,Australian_terrier,0.00494869,True,3737,11650
494,783466772167098368,2016-10-05 00:40:09,This is Finn. He likes eavesdropping from filing cabinets. It's a real issue but no one has approached him about it. 11/10 would still pet https://t.co/s8W8Del9HQ,Finn,,1.1,https://pbs.twimg.com/media/Ct9u3ljW8AEnVIm.jpg,1,Chihuahua,0.789,True,miniature_pinscher,0.0115916,True,toy_terrier,0.0036293899999999997,True,2608,9468
495,783391753726550016,2016-10-04 19:42:03,Meet Godi. He's an avid beachgoer and part time rainbow summoner. Eyeliner flawless af. 13/10 would snug well https://t.co/BO936YdJdi,Godi,,1.3,https://pbs.twimg.com/media/Ct8qn8EWIAAk9zP.jpg,4,Norwegian_elkhound,0.87713,True,cairn,0.00862406,True,keeshond,0.00110191,True,6441,18908
496,783085703974514689,2016-10-03 23:25:55,This is Earl. He can't catch. Did his best tho. 11/10 would repair confidence with extra pats https://t.co/IsqyvbjFgM,Earl,,1.1,https://pbs.twimg.com/media/Ct4URfWUAAQ7lKe.jpg,1,Chesapeake_Bay_retriever,0.240602,True,Airedale,0.0164088,True,boxer,0.013450599999999998,True,2565,9112
497,782747134529531904,2016-10-03 01:00:34,This is Deacon. He's the happiest almost dry doggo I've ever seen. 11/10 would smile back https://t.co/C6fUMnHt1H,Deacon,doggo,1.1,https://pbs.twimg.com/media/CtzgXgeXYAA1Gxw.jpg,1,golden_retriever,0.560699,True,otterhound,0.0199482,True,clumber,0.004068179999999999,True,1604,8310
498,782598640137187329,2016-10-02 15:10:30,This is Timmy. He's quite large. According to a trusted source it's actually a dog wearing a dog suit. 11/10 https://t.co/BIUchFwHqn,Timmy,,1.1,https://pbs.twimg.com/media/CtxZTtxUMAEduGo.jpg,1,malamute,0.8408709999999999,True,Tibetan_mastiff,0.014051600000000001,True,Eskimo_dog,0.0012011600000000002,True,2184,8694
499,782305867769217024,2016-10-01 19:47:08,This is Sampson. He just graduated. Ready to be a doggo now. Time for the real world. 12/10 have fun with taxes https://t.co/pgVKxRw0s1,Sampson,doggo,1.2,https://pbs.twimg.com/media/CttPBt0WIAAcsDE.jpg,1,briard,0.5044270000000001,True,soft-coated_wheaten_terrier,0.0390678,True,Lhasa,0.00345955,True,6470,18630
500,781955203444699136,2016-09-30 20:33:43,This is Chipson. He weighed in at .3 ounces and is officially super h*ckin smol. Space-saving af. 11/10 would snug delicately https://t.co/FjEsk7A1JV,Chipson,,1.1,https://pbs.twimg.com/media/CtoQGu4XgAQgv5m.jpg,1,pool_table,0.179568,False,dining_table,0.015439600000000001,False,microwave,0.0033690499999999997,False,3920,12357
501,781661882474196992,2016-09-30 01:08:10,Who keeps sending in pictures without dogs in them? This needs to stop. 5/10 for the mediocre road https://t.co/ELqelxWMrC,,,0.5,https://pbs.twimg.com/media/CtkFS72WcAAiUrs.jpg,1,Pembroke,0.438087,True,golden_retriever,0.022695399999999998,True,collie,0.007065160000000001,True,3129,11634
502,781524693396357120,2016-09-29 16:03:01,Idk why this keeps happening. We only rate dogs. Not Bangladeshi Couch Chipmunks. Please only send dogs... 12/10 https://t.co/ya7bviQUUf,,,1.2,https://pbs.twimg.com/media/CtiIj0AWcAEBDvw.jpg,1,tennis_ball,0.994712,False,Chesapeake_Bay_retriever,0.00035225,True,Labrador_retriever,9.21439e-05,True,6426,23163
503,781251288990355457,2016-09-28 21:56:36,This is Oakley. He just got yelled at for going 46 in a 45. Churlish af. 11/10 would still pet so well https://t.co/xIYsa6LPA4,Oakley,,1.1,https://pbs.twimg.com/media/CteP5H5WcAEhdLO.jpg,2,Mexican_hairless,0.8877709999999999,True,Italian_greyhound,0.00306664,True,seat_belt,0.00267298,False,2458,9428
504,781163403222056960,2016-09-28 16:07:23,"We normally don't rate lobsters, but this one appears to be a really good lobster. 10/10 would pet with caution https://t.co/YkHc7U7uUy",,,1.0,https://pbs.twimg.com/media/Ctc_-BTWEAAQpZh.jpg,1,Shetland_sheepdog,0.973841,True,collie,0.00251876,True,Border_collie,2.9731100000000004e-05,True,3168,10895
505,780931614150983680,2016-09-28 00:46:20,I want to finally rate this iconic puppo who thinks the parade is all for him. 13/10 would absolutely attend https://t.co/5dUYOu4b8d,,puppo,1.3,https://pbs.twimg.com/media/CtZtJxAXEAAyPGd.jpg,1,padlock,0.731564,False,necklace,0.00654616,False,chain,0.0036469099999999997,False,8536,24192
506,780858289093574656,2016-09-27 19:54:58,"This is Dash. He's very stylish, but also incredibly unimpressed with the current state of our nation. 10/10 would pet ears first https://t.co/YElO4hvXI6",Dash,,1.0,https://pbs.twimg.com/media/CtYqeNHWgAATqYZ.jpg,1,Chesapeake_Bay_retriever,0.488555,True,Sussex_spaniel,0.027165500000000002,True,kelpie,0.010691299999999999,True,2328,8033
507,780800785462489090,2016-09-27 16:06:28,This is Koda. He has a weird relationship with tall grass. Slightly concerning. 11/10 would def still pet https://t.co/KQzSR8eCsw,Koda,,1.1,https://pbs.twimg.com/media/CtX2Kr9XYAAuxrM.jpg,2,Siberian_husky,0.951963,True,Eskimo_dog,0.0035346099999999997,True,Pembroke,0.0008861940000000001,True,1505,6141
508,780543529827336192,2016-09-26 23:04:13,Here's a perturbed super floof. 12/10 would snug so damn well https://t.co/VG095mi09Q,,,1.2,https://pbs.twimg.com/media/CtUMLzRXgAAbZK5.jpg,1,golden_retriever,0.628312,True,Labrador_retriever,0.0317365,True,Tibetan_mastiff,0.00122601,True,2032,7040
509,780459368902959104,2016-09-26 17:29:48,"This is Bear. Don't worry, he's not a real bear tho. Contains unreal amounts of squish. 11/10 heteroskedastic af https://t.co/coi4l1T2Sm",Bear,,1.1,https://pbs.twimg.com/media/CtS_p9kXEAE2nh8.jpg,1,Great_Dane,0.382491,True,German_shepherd,0.031202600000000004,True,bull_mastiff,0.00332719,True,1224,5892
510,780192070812196864,2016-09-25 23:47:39,We only rate dogs. Pls stop sending in non-canines like this Urban Floof Giraffe. I can't handle this. 11/10 https://t.co/zHIqpM5Gni,,,1.1,https://pbs.twimg.com/media/CtPMhwvXYAIt6NG.jpg,1,vizsla,0.144012,True,mongoose,0.009147360000000004,False,hatchet,0.00735447,False,2589,9712
511,779377524342161408,2016-09-23 17:50:56,Have you ever seen such a smol pupper? Portable af. 12/10 would keep in shirt pocket https://t.co/KsqaIzlQ12,,pupper,1.2,https://pbs.twimg.com/ext_tw_video_thumb/779377444025499652/pu/img/eIiLDy9F6rPNarEc.jpg,1,sundial,0.17092100000000002,False,cash_machine,0.00603586,False,maze,0.00549814,False,3613,9831
512,779123168116150273,2016-09-23 01:00:13,This is Reggie. He hugs everyone he meets. 12/10 keep spreading the love Reggie https://t.co/uMfhduaate,Reggie,,1.2,https://pbs.twimg.com/media/CtAAYizW8AAWzBZ.jpg,1,toy_poodle,0.43108,True,soft-coated_wheaten_terrier,0.00603649,True,cocker_spaniel,0.005984540000000002,True,4207,13206
513,778990705243029504,2016-09-22 16:13:51,This is Jay. He's really h*ckin happy about the start of fall. Sneaky tongue slip in 2nd pic. 11/10 snuggly af https://t.co/vyx1X5eyWI,Jay,,1.1,https://pbs.twimg.com/media/Cs-H5uhWcAAiNY9.jpg,2,cocker_spaniel,0.7153510000000001,True,Labrador_retriever,0.020705599999999998,True,Chihuahua,0.00285194,True,8437,22342
514,778748913645780993,2016-09-22 00:13:04,"This is Mya (pronounced ""mmmyah?""). Her head is round af. 11/10 would pat accordingly https://t.co/1dpEuALnY0",Mya,,1.1,https://pbs.twimg.com/media/Cs6r_-kVIAALh1p.jpg,1,Staffordshire_bullterrier,0.351434,True,boxer,0.0201478,True,American_Staffordshire_terrier,0.014283800000000003,True,1562,7717
515,778650543019483137,2016-09-21 17:42:10,"Meet Strider. He thinks he's a sorority girl. Already wants to go to NYC for a weekend to say he's ""studied abroad"" 10/10 https://t.co/KYZkPuiC1l",Strider,,1.0,https://pbs.twimg.com/media/Cs5ShihWEAAH2ti.jpg,1,German_shepherd,0.515699,True,malinois,0.0300292,True,kelpie,0.008702230000000002,True,1729,6430
516,778624900596654080,2016-09-21 16:00:17,This is Penny. She's a sailor pup. 11/10 would take to the open seas with https://t.co/0rRxyBQt32,Penny,,1.1,https://pbs.twimg.com/media/Cs47N3eWcAEmgiW.jpg,2,Airedale,0.786089,True,Irish_terrier,0.0121488,True,Lakeland_terrier,0.00146031,True,1176,5177
517,778408200802557953,2016-09-21 01:39:11,RIP Loki. Thank you for the good times. You will be missed by many. 14/10 https://t.co/gJKD9pst5A,,,1.4,https://pbs.twimg.com/media/Cs12ICuWAAECNRy.jpg,3,Pembroke,0.8483620000000001,True,Cardigan,0.0108124,True,beagle,0.00119417,True,5023,15135
