,tweet_id,timestamp,text,name,stages,rating,jpg_url,img_num,p1,p1_conf,p1_dog,p2,p2_conf,p2_dog,p3,p3_conf,p3_dog,retweet_count,favourite_count
0,892420643555336193,2017-08-01 16:23:56,This is Phineas. He's a mystical boy. Only ever appears in the hole of a donut. 13/10 https://t.co/MgUWQ76dJU,Phineas,,1.3,https://pbs.twimg.com/media/DGKD1-bXoAAIAUK.jpg,1,orange,0.0970486,False,bagel,0.008585110000000002,False,banana,0.007611,False,8853,39467
1,892177421306343426,2017-08-01 00:17:27,"This is Tilly. She's just checking pup on you. Hopes you're doing ok. If not, she's available for pats, snugs, boops, the whole bit. 13/10 https://t.co/0Xxu71qeIV",Tilly,,1.3,https://pbs.twimg.com/media/DGGmoV4XsAAUL6n.jpg,1,Chihuahua,0.323581,True,Pekinese,0.00906465,True,papillon,0.00689569,True,6514,33819
2,891815181378084864,2017-07-31 00:18:03,This is Archie. He is a rare Norwegian Pouncing Corgo. Lives in the tall grass. You never know when one may strike. 12/10 https://t.co/wUnZnhtVJB,Archie,,1.2,https://pbs.twimg.com/media/DGBdLU1WsAANxJ9.jpg,1,Chihuahua,0.716012,True,malamute,0.0078253,True,kelpie,0.00313789,True,4328,25461
3,891689557279858688,2017-07-30 15:58:51,This is Darla. She commenced a snooze mid meal. 13/10 happens to the best of us https://t.co/tD36da7qLQ,Darla,,1.3,https://pbs.twimg.com/media/DF_q7IAWsAEuuN8.jpg,1,paper_towel,0.17027799999999998,False,Labrador_retriever,0.0168086,True,spatula,0.00408359,False,8964,42908
4,891327558926688256,2017-07-29 16:00:24,"This is Franklin. He would like you to stop calling him ""cute."" He is a very fierce shark and should be respected as such. 12/10 #BarkWeek https://t.co/AtUZn91f7f",Franklin,,1.2,https://pbs.twimg.com/media/DF6hr6BUMAAzZgT.jpg,2,basset,0.555712,True,English_springer,0.022577,True,German_short-haired_pointer,0.0175219,True,9774,41048
5,891087950875897856,2017-07-29 00:08:17,Here we have a majestic great white breaching off South Africa's coast. Absolutely h*ckin breathtaking. 13/10 (IG: tucker_marlo) #BarkWeek https://t.co/kQ04fDDRmh,,,1.3,https://pbs.twimg.com/media/DF3HwyEWsAABqE6.jpg,1,Chesapeake_Bay_retriever,0.425595,True,Irish_terrier,0.0116317,True,Indian_elephant,0.007690219999999999,False,3261,20562
6,890971913173991426,2017-07-28 16:27:12,"Meet Jax. He enjoys ice cream so much he gets nervous around it. 13/10 help Jax enjoy more things by clicking below

https://t.co/Zr4hWfAs1H https://t.co/tVJBRMnhxl",Jax,,1.3,https://pbs.twimg.com/media/DF1eOmZXUAALUcq.jpg,1,Appenzeller,0.34170300000000003,True,Border_collie,0.0199287,True,ice_lolly,0.0193548,False,2158,12041
7,890729181411237888,2017-07-28 00:22:40,When you watch your owner call another dog a good boy but then they turn back to you and say you're a great boy. 13/10 https://t.co/v0nONBcwxq,,,1.3,https://pbs.twimg.com/media/DFyBahAVwAAhUTd.jpg,2,Pomeranian,0.566142,True,Eskimo_dog,0.017840599999999998,True,Pembroke,0.00765069,True,16716,56848
8,890609185150312448,2017-07-27 16:25:51,This is Zoey. She doesn't want to be one of the scary sharks. Just wants to be a snuggly pettable boatpet. 13/10 #BarkWeek https://t.co/9TwLuAGH0b,Zoey,,1.3,https://pbs.twimg.com/media/DFwUU__XcAEpyXI.jpg,1,Irish_terrier,0.487574,True,Irish_setter,0.0193054,True,Chesapeake_Bay_retriever,0.0118184,True,4429,28226
9,890240255349198849,2017-07-26 15:59:51,This is Cassie. She is a college pup. Studying international doggo communication and stick theory. 14/10 so elegant much sophisticate https://t.co/t1bfwz5S2A,Cassie,doggo,1.4,https://pbs.twimg.com/media/DFrEyVuW0AAO3t9.jpg,1,Pembroke,0.511319,True,Cardigan,0.0451038,True,Chihuahua,0.00292482,True,7711,32467
10,890006608113172480,2017-07-26 00:31:25,This is Koda. He is a South Australian deckshark. Deceptively deadly. Frighteningly majestic. 13/10 would risk a petting #BarkWeek https://t.co/dVPW0B0Mme,Koda,,1.3,https://pbs.twimg.com/media/DFnwSY4WAAAMliS.jpg,1,Samoyed,0.957979,True,Pomeranian,0.00138835,True,chow,0.000816748,True,7624,31166
11,889880896479866881,2017-07-25 16:11:53,This is Bruno. He is a service shark. Only gets out of the water to assist you. 13/10 terrifyingly good boy https://t.co/u1XPQMl29g,Bruno,,1.3,https://pbs.twimg.com/media/DFl99B1WsAITKsg.jpg,1,French_bulldog,0.377417,True,Labrador_retriever,0.015131700000000001,True,muzzle,0.008298110000000001,False,5156,28268
12,889665388333682689,2017-07-25 01:55:32,Here's a puppo that seems to be on the fence about something haha no but seriously someone help her. 13/10 https://t.co/BxvuXk0UCm,,puppo,1.3,https://pbs.twimg.com/media/DFi579UWsAAatzw.jpg,1,Pembroke,0.966327,True,Cardigan,0.00273557,True,basenji,0.000463323,True,8538,38818
13,889638837579907072,2017-07-25 00:10:02,This is Ted. He does his best. Sometimes that's not enough. But it's ok. 12/10 would assist https://t.co/f8dEDcrKSR,Ted,,1.2,https://pbs.twimg.com/media/DFihzFfXsAYGDPR.jpg,1,French_bulldog,0.99165,True,boxer,0.00021286399999999997,True,Staffordshire_bullterrier,0.000149818,True,4735,27672
14,889531135344209921,2017-07-24 17:02:04,This is Stuart. He's sporting his favorite fanny pack. Secretly filled with bones only. 13/10 puppared puppo #BarkWeek https://t.co/y70o6h3isq,Stuart,puppo,1.3,https://pbs.twimg.com/media/DFg_2PVW0AEHN3p.jpg,1,golden_retriever,0.953442,True,Labrador_retriever,0.00138341,True,redbone,0.000795775,True,2321,15359
15,889278841981685760,2017-07-24 00:19:32,This is Oliver. You're witnessing one of his many brutal attacks. Seems to be playing with his victim. 13/10 fr*ckin frightening #BarkWeek https://t.co/WpHvrQedPb,Oliver,,1.3,https://pbs.twimg.com/ext_tw_video_thumb/889278779352338437/pu/img/VlbFB3v8H8VwzVNY.jpg,1,whippet,0.626152,True,borzoi,0.0194742,True,Saluki,0.00273507,True,5637,25652
16,888917238123831296,2017-07-23 00:22:39,This is Jim. He found a fren. Taught him how to sit like the good boys. 12/10 for both https://t.co/chxruIOUJN,Jim,,1.2,https://pbs.twimg.com/media/DFYRgsOUQAARGhO.jpg,1,golden_retriever,0.714719,True,Tibetan_mastiff,0.0120184,True,Labrador_retriever,0.0105506,True,4709,29611
17,888804989199671297,2017-07-22 16:56:37,This is Zeke. He has a new stick. Very proud of it. Would like you to throw it for him without taking it. 13/10 would do my best https://t.co/HTQ77yNQ5K,Zeke,,1.3,https://pbs.twimg.com/media/DFWra-3VYAA2piG.jpg,1,golden_retriever,0.46976,True,Labrador_retriever,0.0184172,True,English_setter,0.007348169999999999,True,4559,26080
18,888554962724278272,2017-07-22 00:23:06,This is Ralphus. He's powering up. Attempting maximum borkdrive. 13/10 inspirational af https://t.co/YnYAFCTTiK,Ralphus,,1.3,https://pbs.twimg.com/media/DFTH_O-UQAACu20.jpg,3,Siberian_husky,0.700377,True,Eskimo_dog,0.0166511,True,malamute,0.0111411,True,3732,20290
19,888078434458587136,2017-07-20 16:49:33,This is Gerald. He was just told he didn't get the job he interviewed for. A h*ckin injustice. 12/10 didn't want the job anyway https://t.co/DK7iDPfuRX,Gerald,,1.2,https://pbs.twimg.com/media/DFMWn56WsAAkA7B.jpg,1,French_bulldog,0.995026,True,pug,9.31908e-05,True,bull_mastiff,9.03211e-05,True,3653,22201
20,887705289381826560,2017-07-19 16:06:48,This is Jeffrey. He has a monopoly on the pool noodles. Currently running a 'boop for two' midweek sale. 13/10 h*ckin strategic https://t.co/PhrUk20Q64,Jeffrey,,1.3,https://pbs.twimg.com/media/DFHDQBbXgAEqY7t.jpg,1,basset,0.821664,True,redbone,0.008758150000000001,True,Weimaraner,0.0026236400000000004,True,5609,30779
21,887517139158093824,2017-07-19 03:39:09,I've yet to rate a Venezuelan Hover Wiener. This is such an honor. 14/10 paw-inspiring af (IG: roxy.thedoxy) https://t.co/20VrLAA8ba,,,1.4,https://pbs.twimg.com/ext_tw_video_thumb/887517108413886465/pu/img/WanJKwssZj4VJvL9.jpg,1,limousine,0.130432,False,tow_truck,0.00291754,False,shopping_cart,0.0026320799999999997,False,12082,46959
22,887343217045368832,2017-07-18 16:08:03,You may not have known you needed to see this today. 13/10 please enjoy (IG: emmylouroo) https://t.co/WZqNqygEyV,,,1.3,https://pbs.twimg.com/ext_tw_video_thumb/887343120832229379/pu/img/6HSuFrW1lzI_9Mht.jpg,1,Mexican_hairless,0.330741,True,sea_lion,0.0275645,False,Weimaraner,0.0134203,True,10737,34222
23,887101392804085760,2017-07-18 00:07:08,This... is a Jubilant Antarctic House Bear. We only rate dogs. Please only send dogs. Thank you... 12/10 would suffocate in floof https://t.co/4Ad1jzJSdp,,,1.2,https://pbs.twimg.com/media/DE-eAq6UwAA-jaE.jpg,1,Samoyed,0.733942,True,Eskimo_dog,0.00350295,True,Staffordshire_bullterrier,0.0029704700000000007,True,6167,31061
24,886983233522544640,2017-07-17 16:17:36,This is Maya. She's very shy. Rarely leaves her cup. 13/10 would find her an environment to thrive in https://t.co/I6oNy0CgiT,Maya,,1.3,https://pbs.twimg.com/media/DE8yicJW0AAAvBJ.jpg,2,Chihuahua,0.793469,True,toy_terrier,0.014352799999999999,True,can_opener,0.00322529,False,8084,35859
25,886736880519319552,2017-07-16 23:58:41,"This is Mingus. He's a wonderful father to his smol pup. Confirmed 13/10, but he needs your help

https://t.co/bVi0Yr4Cff https://t.co/ISvKOSkd5b",Mingus,,1.3,https://pbs.twimg.com/media/DE5Se8FXcAAJFx4.jpg,1,kuvasz,0.309706,True,Great_Pyrenees,0.0186136,True,Dandie_Dinmont,0.00863463,True,3443,12306
26,886680336477933568,2017-07-16 20:14:00,This is Derek. He's late for a dog meeting. 13/10 pet...al to the metal https://t.co/BCoWue0abA,Derek,,1.3,https://pbs.twimg.com/media/DE4fEDzWAAAyHMM.jpg,1,convertible,0.738995,False,sports_car,0.0139952,False,car_wheel,0.00441727,False,4610,22798
27,886366144734445568,2017-07-15 23:25:31,This is Roscoe. Another pupper fallen victim to spontaneous tongue ejections. Get the BlepiPen immediate. 12/10 deep breaths Roscoe https://t.co/RGE08MIJox,Roscoe,pupper,1.2,https://pbs.twimg.com/media/DE0BTnQUwAApKEH.jpg,1,French_bulldog,0.999201,True,Chihuahua,3.6117799999999995e-05,True,Boston_bull,7.55616e-06,True,3316,21524
28,886258384151887873,2017-07-15 16:17:19,This is Waffles. His doggles are pupside down. Unsure how to fix. 13/10 someone assist Waffles https://t.co/xZDA9Qsq1O,Waffles,,1.3,https://pbs.twimg.com/media/DEyfTG4UMAE4aE9.jpg,1,pug,0.943575,True,shower_cap,0.00252856,False,Siamese_cat,0.000284892,False,6523,28469
29,885984800019947520,2017-07-14 22:10:11,Viewer discretion advised. This is Jimbo. He will rip ur finger right h*ckin off. Other dog clearly an accessory. 12/10 pls pet with caution https://t.co/BuveP0uMF1,Jimbo,,1.2,https://pbs.twimg.com/media/DEumeWWV0AA-Z61.jpg,1,Blenheim_spaniel,0.972494,True,Shih-Tzu,0.0006630119999999999,True,Bernese_mountain_dog,0.000623915,True,7097,33382
30,885528943205470208,2017-07-13 15:58:47,This is Maisey. She fell asleep mid-excavation. Happens to the best of us. 13/10 would pat noggin approvingly https://t.co/tp1kQ8i9JF,Maisey,,1.3,https://pbs.twimg.com/media/DEoH3yvXgAAzQtS.jpg,1,pug,0.369275,True,Labrador_retriever,0.0265835,True,kuvasz,0.013469700000000001,True,6683,36689
31,885167619883638784,2017-07-12 16:03:00,Here we have a corgi undercover as a malamute. Pawbably doing important investigative work. Zero control over tongue happenings. 13/10 https://t.co/44ItaMubBf,,,1.3,https://pbs.twimg.com/media/DEi_N9qXYAAgEEw.jpg,4,malamute,0.8124819999999999,True,Siberian_husky,0.00717125,True,Eskimo_dog,0.00557697,True,4556,22367
32,884925521741709313,2017-07-12 00:01:00,"This is Earl. He found a hat. Nervous about what you think of it. 12/10 it's delightful, Earl https://t.co/MYJvdlNRVa",Earl,,1.2,https://pbs.twimg.com/media/DEfjEaNXkAAtPlj.jpg,1,Italian_greyhound,0.259916,True,American_Staffordshire_terrier,0.019845099999999997,True,Staffordshire_bullterrier,0.0127725,True,16439,68152
33,884876753390489601,2017-07-11 20:47:12,This is Lola. It's her first time outside. Must test the earth and taste the atmosphere. 13/10 you're doing great Lola https://t.co/74TKAUsLkO,Lola,,1.3,https://pbs.twimg.com/media/DEe2tZXXkAAwyX3.jpg,1,chow,0.822103,True,Norwich_terrier,0.0106075,True,Norfolk_terrier,0.00373485,True,6096,28514
34,884562892145688576,2017-07-11 00:00:02,This is Kevin. He's just so happy. 13/10 what is your secret Kevin https://t.co/1r4MFCbCX5,Kevin,,1.3,https://pbs.twimg.com/media/DEaZQkfXUAEC7qB.jpg,1,pug,0.5464060000000001,True,French_bulldog,0.0404291,True,Brabancon_griffon,0.00440019,True,5100,24765
35,884441805382717440,2017-07-10 15:58:53,"I present to you, Pup in Hat. Pup in Hat is great for all occasions. Extremely versatile. Compact as h*ck. 14/10 (IG: itselizabethgales) https://t.co/vvBOcC2VdC",,,1.4,https://pbs.twimg.com/media/DEYrIZwWsAA2Wo5.jpg,1,Pembroke,0.993225,True,Cardigan,0.000321648,True,Chihuahua,0.000208089,True,5856,27478
36,884162670584377345,2017-07-09 21:29:42,Meet Yogi. He doesn't have any important dog meetings today he just enjoys looking his best at all times. 12/10 for dangerously dapper doggo https://t.co/YSI00BzTBZ,Yogi,doggo,1.2,https://pbs.twimg.com/media/DEUtQbzW0AUTv_o.jpg,1,German_shepherd,0.707046,True,malinois,0.0199396,True,Norwegian_elkhound,0.00491476,True,3128,20771
37,883838122936631299,2017-07-09 00:00:04,This is Noah. He can't believe someone made this mess. Got the vacuum out for you though. Offered to help clean pup. 12/10 super good boy https://t.co/V85xujjDDY,Noah,,1.2,https://pbs.twimg.com/media/DEQGFgAXUAAEvfi.jpg,1,Doberman,0.610946,True,miniature_pinscher,0.029960300000000002,True,kelpie,0.00630203,True,3586,22349
38,883482846933004288,2017-07-08 00:28:19,"This is Bella. She hopes her smile made you smile. If not, she is also offering you her favorite monkey. 13.5/10 https://t.co/qjrljjt948",Bella,,0.5,https://pbs.twimg.com/media/DELC9dZXUAADqUk.jpg,1,golden_retriever,0.943082,True,Labrador_retriever,0.0032409,True,kuvasz,0.000550072,True,10407,46860
39,883360690899218434,2017-07-07 16:22:55,Meet Grizzwald. He may be the floofiest floofer I ever did see. Lost eyes saving a schoolbus from a volcano erpuption. 13/10 heroic as h*ck https://t.co/rf661IFEYP,Grizzwald,floofer,1.3,https://pbs.twimg.com/media/DEJT3FeXoAAtwUy.jpg,1,chow,0.987997,True,Tibetan_mastiff,0.0007098720000000001,True,Newfoundland,0.00021403300000000003,True,3825,22986
40,883117836046086144,2017-07-07 00:17:54,"Please only send dogs. We don't rate mechanics, no matter how h*ckin good. Thank you... 13/10 would sneak a pat https://t.co/Se5fZ9wp5E",,,1.3,https://pbs.twimg.com/media/DEF2-_hXoAAs62q.jpg,2,golden_retriever,0.949562,True,Labrador_retriever,0.004594790000000001,True,kuvasz,0.000247094,True,6949,37914
41,882992080364220416,2017-07-06 15:58:11,This is Rusty. He wasn't ready for the first pic. Clearly puppared for the second. 13/10 confirmed great boy https://t.co/tyER0KpdXj,Rusty,,1.3,https://pbs.twimg.com/media/DEEEnIqXYAAiJh_.jpg,1,Eskimo_dog,0.466778,True,Siberian_husky,0.0406044,True,dingo,0.007341439999999999,False,4122,24445
42,882762694511734784,2017-07-06 00:46:41,This is Gus. He's quite the cheeky pupper. Already perfected the disinterested wink. 12/10 would let steal my girl https://t.co/D43I96SlVu,Gus,pupper,1.2,https://pbs.twimg.com/media/DEAz_HHXsAA-p_z.jpg,1,Labrador_retriever,0.85005,True,Chesapeake_Bay_retriever,0.0074257,True,flat-coated_retriever,0.0015579399999999996,True,5134,28903
43,882627270321602560,2017-07-05 15:48:34,This is Stanley. He has his first swim lesson today. Doggle straps adjusted. Ready to go. 13/10 Phelps is nervous (IG: stanleythe_corgi) https://t.co/Nx52PGwH94,Stanley,,1.3,https://pbs.twimg.com/media/DD-40X3WAAAJPU5.jpg,1,Pembroke,0.542982,True,Chihuahua,0.0251988,True,Cardigan,0.0107699,True,6342,28382
44,882268110199369728,2017-07-04 16:01:23,This is Alfy. You're witnessing his first watermelon experience. I think it was a success. 13/10 happy 4th Alfy ðŸ‡ºðŸ‡¸ https://t.co/fYP5RlutfA,Alfy,,1.3,https://pbs.twimg.com/media/DD5yKdPW0AArzX8.jpg,1,golden_retriever,0.762211,True,Labrador_retriever,0.00989849,True,cocker_spaniel,0.00171995,True,12118,45880
45,882045870035918850,2017-07-04 01:18:17,"This is Koko. Her owner, inspired by Barney, recently built a cart for her to use during walks if she got tired. 13/10 rest easy Koko https://t.co/zeDpnsKX7w",Koko,,1.3,https://pbs.twimg.com/media/DD2oCl2WAAEI_4a.jpg,1,web_site,0.949591,False,dhole,0.0017325799999999998,False,golden_retriever,0.000694063,True,5203,29900
46,881906580714921986,2017-07-03 16:04:48,This is Rey. He's a Benebop Cumberfloof. 12/10 dangerously pettable https://t.co/503CgWbhxQ,Rey,,1.2,https://pbs.twimg.com/media/DD0pWm9XcAAeSBL.jpg,1,Weimaraner,0.291539,True,Chesapeake_Bay_retriever,0.0278966,True,koala,0.012701700000000002,False,3533,24773
47,881666595344535552,2017-07-03 00:11:11,This is Gary. He couldn't miss this puppertunity for a selfie. Flawless focusing skills. 13/10 would boop intensely https://t.co/7CSWCl8I6s,Gary,pupper,1.3,https://pbs.twimg.com/media/DDxPFwbWAAEbVVR.jpg,1,Saluki,0.529012,True,Afghan_hound,0.025000300000000003,True,golden_retriever,0.016073900000000002,True,11099,51522
48,881536004380872706,2017-07-02 15:32:16,"Here is a pupper approaching maximum borkdrive. Zooming at never before seen speeds. 14/10 paw-inspiring af 
(IG: puffie_the_chow) https://t.co/ghXBIIeQZF",,pupper,1.4,https://pbs.twimg.com/ext_tw_video_thumb/881535971568889856/pu/img/9bawiZ--8FKywTkz.jpg,1,Samoyed,0.281463,True,Angora,0.027206599999999997,False,Persian_cat,0.0114854,False,16570,50199
49,881268444196462592,2017-07-01 21:49:04,Meet Elliot. He's a Canadian Forrest Pup. Unusual number of antlers for a dog. Sneaky tongue slip to celebrate #Canada150. 12/10 would pet https://t.co/cgwJwowTMC,Elliot,,1.2,https://pbs.twimg.com/media/DDrk-f9WAAI-WQv.jpg,1,tusker,0.473303,False,Indian_elephant,0.0245646,False,ibex,0.00556607,False,5358,23501
50,880935762899988482,2017-06-30 23:47:07,This is Louis. He's crossing. It's a big deal. 13/10 h*ckin breathtaking https://t.co/D0wb1GlKAt,Louis,,1.3,https://pbs.twimg.com/media/DDm2Z5aXUAEDS2u.jpg,1,street_sign,0.251801,False,umbrella,0.0115123,False,traffic_light,0.00695338,False,2886,17346
51,880872448815771648,2017-06-30 19:35:32,Ugh not again. We only rate dogs. Please don't send in well-dressed  floppy-tongued street penguins. Dogs only please. Thank you... 12/10 https://t.co/WiAMbTkDPf,,,1.2,https://pbs.twimg.com/media/DDl8zzJW0AAisCJ.jpg,1,Pembroke,0.791416,True,Norwich_terrier,0.00613929,True,Chihuahua,0.0033725699999999996,True,3989,21734
52,880465832366813184,2017-06-29 16:39:47,This is Bella. She had her first beach experience this morning. Complete success. 12/10 would perform a sandy boop https://t.co/4VsFysDmiw,Bella,,1.2,https://pbs.twimg.com/media/DDgK-J4XUAIEV9W.jpg,1,golden_retriever,0.913255,True,Labrador_retriever,0.00263286,True,cocker_spaniel,0.000937082,True,6546,29075
53,880221127280381952,2017-06-29 00:27:25,Meet Jesse. He's a Fetty Woof. His tongue ejects without warning. A true bleptomaniac. 12/10 would snug well https://t.co/fUod0tVmvK,Jesse,,1.2,https://pbs.twimg.com/media/DDcscbXU0AIfDzs.jpg,1,Chihuahua,0.238525,True,meerkat,0.0104256,False,clumber,0.00525803,True,4436,27640
54,880095782870896641,2017-06-28 16:09:20,Please don't send in photos without dogs in them. We're not @porch_rates. Insubordinate and churlish. Pretty good porch tho 11/10 https://t.co/HauE8M3Bu4,,,1.1,https://pbs.twimg.com/media/DDa6ckbXgAAM1vV.jpg,1,miniature_pinscher,0.120298,True,Rhodesian_ridgeback,0.0106395,True,beagle,0.0106073,True,4533,28150
55,879862464715927552,2017-06-28 00:42:13,This is Romeo. He would like to do an entrance. Requesting your immediate assistance. 13/10 https://t.co/Qh5aEkRQm9,Romeo,,1.3,https://pbs.twimg.com/media/DDXmPrbWAAEKMvy.jpg,3,basset,0.813507,True,beagle,0.0146654,True,cocker_spaniel,0.000948502,True,3642,22667
56,879492040517615616,2017-06-27 00:10:17,This is Bailey. He thinks you should measure ear length for signs of growth instead. 12/10 https://t.co/IxM9IMKQq8,Bailey,,1.2,https://pbs.twimg.com/media/DDSVWMvXsAEgmMK.jpg,1,German_short-haired_pointer,0.479896,True,vizsla,0.0124353,True,bath_towel,0.00733202,False,3323,23822
57,879415818425184262,2017-06-26 19:07:24,This is Duddles. He did an attempt. 13/10 someone help him (vid by Georgia Felici) https://t.co/UDT7ZkcTgY,Duddles,,1.3,https://pbs.twimg.com/ext_tw_video_thumb/879415784908390401/pu/img/cX7XI1TnUsseGET5.jpg,1,English_springer,0.383404,True,Boston_bull,0.0134967,True,Cardigan,0.0110481,True,45849,107956
58,879376492567855104,2017-06-26 16:31:08,This is Jack AKA Stephen Furry. You're not scoring on him. Unless he slips down the slide. 12/10 would happily get blocked by https://t.co/0gOi601EAa,Jack,,1.2,https://pbs.twimg.com/media/DDQsQGFV0AAw6u9.jpg,1,tricycle,0.663601,False,Labrador_retriever,0.0033496100000000003,True,Pembroke,0.00188266,True,3261,17099
59,879050749262655488,2017-06-25 18:56:45,This is Steven. He has trouble relating to other dogs. Quite shy. Neck longer than average. Tropical probably. 11/10 would still pet https://t.co/2mJCDEJWdD,Steven,,1.1,https://pbs.twimg.com/media/DDMD_phXoAQ1qf0.jpg,1,tabby,0.311861,False,window_screen,0.016912299999999998,False,Egyptian_cat,0.0132932,False,4941,23022
60,879008229531029506,2017-06-25 16:07:47,This is Beau. That is Beau's balloon. He takes it everywhere. 13/10 would protect at all costs https://t.co/YDtpCjIPKN,Beau,,1.3,https://pbs.twimg.com/media/DDLdUrqXYAMOVzY.jpg,1,vizsla,0.960513,True,miniature_pinscher,0.0009430650000000001,True,American_Staffordshire_terrier,0.00087113,True,2812,19317
61,878776093423087618,2017-06-25 00:45:22,This is Snoopy. He's a proud #PrideMonthPuppo. Impeccable handwriting for not having thumbs. 13/10 would love back #PrideMonth https://t.co/lNZwgNO4gS,Snoopy,puppo,1.3,https://pbs.twimg.com/media/DDIKMXzW0AEibje.jpg,2,Italian_greyhound,0.734684,True,whippet,0.015048699999999998,True,Ibizan_hound,0.00397246,True,4319,19763
62,878281511006478336,2017-06-23 16:00:04,"Meet Shadow. In an attempt to reach maximum zooming borkdrive, he tore his ACL. Still 13/10 tho. Help him out below

https://t.co/245xJJElsY https://t.co/lUiQH219v6",Shadow,,1.3,https://pbs.twimg.com/media/DDBIX9QVYAAohGa.jpg,1,basset,0.32042,True,collie,0.0215975,True,Appenzeller,0.012850699999999998,True,1349,7913
63,878057613040115712,2017-06-23 01:10:23,This is Emmy. She was adopted today. Massive round of pupplause for Emmy and her new family. 14/10 for all involved https://t.co/cwtWnHMVpe,Emmy,,1.4,https://pbs.twimg.com/media/DC98vABUIAA97pz.jpg,1,French_bulldog,0.839097,True,Boston_bull,0.007879939999999998,True,toy_terrier,0.0015243400000000001,True,7181,42876
64,877736472329191424,2017-06-22 03:54:17,This is Aja. She was just told she's a good dog. Suspicions confirmed. 13/10 would tell again https://t.co/lsPyyAiF1r,Aja,,1.3,https://pbs.twimg.com/media/DC5YqoQW0AArOLH.jpg,2,Chesapeake_Bay_retriever,0.8379559999999999,True,Labrador_retriever,0.006203419999999999,True,Weimaraner,0.00405991,True,17300,71144
65,877556246731214848,2017-06-21 15:58:08,This is Penny. She's both pupset and fired pup. Not pleased w your barbaric attempts at cleanliness. 12/10 would enjoy more shampoo options https://t.co/OYdDlfOGXP,Penny,,1.2,https://pbs.twimg.com/media/DC20wEcW0AAf59m.jpg,1,basset,0.995368,True,Welsh_springer_spaniel,0.000193621,True,bathtub,4.67919e-05,False,3994,23258
66,877316821321428993,2017-06-21 00:06:44,"Meet Dante. At first he wasn't a fan of his new raincoat, then he saw his reflection. H*ckin handsome. 13/10 for water resistant good boy https://t.co/SHRTIo5pxc",Dante,,1.3,https://pbs.twimg.com/media/DCza_vtXkAQXGpC.jpg,1,Saluki,0.5099670000000001,True,Italian_greyhound,0.00904973,True,golden_retriever,0.00794058,True,5414,27907
67,877201837425926144,2017-06-20 16:29:50,This is Nelly. He graduated with his dogtorate today. Wants to know if you're proud of him. 12/10 would give congratulatory boop https://t.co/4g4cfj3P4Y,Nelly,,1.2,https://pbs.twimg.com/media/DCxyahJWsAAddSC.jpg,1,Pembroke,0.93112,True,Cardigan,0.0068698200000000004,True,basenji,8.17379e-06,True,5880,27755
68,876838120628539392,2017-06-19 16:24:33,This is Ginger. She's having a ruff Monday. Too many pupper things going on. H*ckin exhausting. 12/10 would snug passionately https://t.co/j211oCDRs6,Ginger,pupper,1.2,https://pbs.twimg.com/media/DCsnnZsVwAEfkyi.jpg,1,bloodhound,0.575751,True,redbone,0.024097,True,Tibetan_mastiff,0.00889348,True,3506,21125
69,876484053909872640,2017-06-18 16:57:37,This is Benedict. He wants to thank you for this delightful urban walk. Hopes you know he loves you. 13/10 super duper good boy https://t.co/26BXueUgbs,Benedict,,1.3,https://pbs.twimg.com/media/DCnll_dUQAAkBdG.jpg,1,golden_retriever,0.874566,True,Irish_terrier,0.0037354199999999997,True,chow,0.00167236,True,2511,19163
70,876120275196170240,2017-06-17 16:52:05,"Meet Venti, a seemingly caffeinated puppoccino. She was just informed the weekend would include walks, pats and scritches. 13/10 much excite https://t.co/ejExJFq3ek",Venti,puppo,1.3,https://pbs.twimg.com/media/DCiavj_UwAAcXep.jpg,1,Bernese_mountain_dog,0.534327,True,Saint_Bernard,0.0346312,True,Greater_Swiss_Mountain_dog,0.00949327,True,4903,28490
71,875747767867523072,2017-06-16 16:11:53,"This is Goose. He's a womanizer. Cheeky as h*ck, but also deep. Tongue slip game on another level. 13/10 will steal your girl https://t.co/V2WlACRJCN",Goose,,1.3,https://pbs.twimg.com/media/DCdH8YpUQAAiEbL.jpg,1,Labrador_retriever,0.799551,True,Chesapeake_Bay_retriever,0.0179975,True,vizsla,0.00046176,True,4497,25773
72,875144289856114688,2017-06-15 00:13:52,Meet Nugget and Hank. Nugget took Hank's bone. Hank is wondering if you would please return it to him. Both 13/10 would not intervene https://t.co/ogith9ejNj,Nugget,,1.3,https://pbs.twimg.com/ext_tw_video_thumb/875144175078957056/pu/img/BRi_l7vUdpb93Knf.jpg,1,Siberian_husky,0.245048,True,Pembroke,0.0223716,True,dingo,0.0160753,False,5081,22185
