,tweet_id,timestamp,text,name,stages,rating,jpg_url,img_num,p1,p1_conf,p1_dog,p2,p2_conf,p2_dog,p3,p3_conf,p3_dog,retweet_count,favourite_count
908,712085617388212225,2016-03-22 01:16:55,"Say hello to Olive and Ruby. They are best buddies. Both 11/10 
1 like = 1 buddy https://t.co/yagmFdKlyL",Olive,,1.1,https://pbs.twimg.com/media/CeHWFksXIAAyypp.jpg,2,Shih-Tzu,0.625129,True,Tibetan_terrier,0.012689700000000002,True,Lhasa,0.011966300000000001,True,556,3531
909,712065007010385924,2016-03-21 23:55:01,This is Chester. He's clearly in charge of the other dogs. Weird ass paws. Not fit for fetch. 6/10 would still pet https://t.co/o2GvskrhHt,Chester,,0.6,https://pbs.twimg.com/media/CeHDV73W0AM5Cf8.jpg,1,goose,0.214301,False,gibbon,0.0084253,False,pizza,0.008016829999999999,False,700,2451
910,711968124745228288,2016-03-21 17:30:03,Meet Winston. He's trapped in a cup of coffee. Poor pupper. 10/10 someone free him https://t.co/2e6cUtKUuc,Winston,pupper,1.0,https://pbs.twimg.com/media/CeFrO3qXEAADRbd.jpg,1,espresso,0.4301350000000001,False,coffee_mug,0.0418483,False,cup,0.008839119999999999,False,2601,8776
911,711743778164514816,2016-03-21 02:38:34,Meet Roosevelt. He's calculating the best case scenario if he drops out instead of doing math hw. 11/10 relatable af https://t.co/QcSIRDpfVg,Roosevelt,,1.1,https://pbs.twimg.com/media/CeCfMPDW0AAAEUj.jpg,1,Lakeland_terrier,0.459515,True,miniature_poodle,0.0219661,True,standard_poodle,0.0130189,True,1101,3095
912,711732680602345472,2016-03-21 01:54:29,I want to hear the joke this dog was just told. 10/10 https://t.co/1KiuZqqOD4,,,1.0,https://pbs.twimg.com/media/CeCVGEbUYAASeY4.jpg,3,dingo,0.366875,False,Ibizan_hound,0.0334929,True,Eskimo_dog,0.007387619999999999,True,4653,9756
913,711652651650457602,2016-03-20 20:36:28,This is Gary. He just wanted to say hi. 9/10 very personable pup https://t.co/Sk3CbhmKSW,Gary,,0.9,https://pbs.twimg.com/media/CeBMT6-WIAA7Qqf.jpg,1,llama,0.8567889999999999,False,Arabian_camel,0.0098727,False,neck_brace,0.00163772,False,1037,4228
914,711363825979756544,2016-03-20 01:28:47,"""Please, no puparazzi"" 11/10 https://t.co/nJIXSPfedK",,,1.1,https://pbs.twimg.com/media/Cd9Fn5QUMAAYMT4.jpg,1,Pembroke,0.7509060000000001,True,Cardigan,0.0241152,True,basenji,0.000263962,True,1287,3996
915,711306686208872448,2016-03-19 21:41:44,What hooligan sent in pictures w/out a dog in them? Churlish af. 3/10 just bc that's a neat fluffy bean bag chair https://t.co/wcwoGOkZvz,,,0.3,https://pbs.twimg.com/media/Cd8Rpl0W0AAN1kU.jpg,1,leatherback_turtle,0.280835,False,loggerhead,0.012329,False,Dandie_Dinmont,0.00867925,True,819,3596
916,711008018775851008,2016-03-19 01:54:56,This is Chuckles. He had a balloon but he accidentally let go of it and it floated away. 11/10 hang in there pupper https://t.co/68iNM7B5gW,Chuckles,pupper,1.1,https://pbs.twimg.com/media/Cd4CBQFW8AAY3ND.jpg,1,French_bulldog,0.731405,True,Boston_bull,0.0150672,True,pug,0.00218109,True,710,3275
917,710997087345876993,2016-03-19 01:11:29,Meet Milo and Amos. They are the best of pals. Both 12/10 would pet at the same time https://t.co/Mv37BHEyyD,Milo,,1.2,https://pbs.twimg.com/media/Cd34FClUMAAnvGP.jpg,1,malamute,0.28126,True,Eskimo_dog,0.0232641,True,Pembroke,0.0091602,True,1561,4960
918,710844581445812225,2016-03-18 15:05:29,This is Staniel. His selfie game is strong af. 10/10 I'd snapchat with Staniel https://t.co/UgkTw7TKyM,Staniel,,1.0,https://pbs.twimg.com/media/Cd1tYGmXIAAoW5b.jpg,1,dingo,0.536593,False,Pembroke,0.0200407,True,basenji,0.006073449999999999,True,779,2775
919,710833117892898816,2016-03-18 14:19:56,Say hello to Sora. She's an Egyptian Pumpernickel. Mesmerizing af. 12/10 would bring home to mom https://t.co/PmTR4kxZkq,Sora,,1.2,https://pbs.twimg.com/media/Cd1i8qvUkAE-Jlr.jpg,1,Pembroke,0.803742,True,Cardigan,0.0189712,True,German_shepherd,0.000174609,True,606,2937
920,710658690886586372,2016-03-18 02:46:49,Here's a brigade of puppers. All look very prepared for whatever happens next. 80/80 https://t.co/0eb7R1Om12,,pupper,1.0,https://pbs.twimg.com/media/CdzETn4W4AAVU5N.jpg,1,soft-coated_wheaten_terrier,0.948617,True,Dandie_Dinmont,0.00186644,True,cairn,0.00159427,True,636,2529
921,710588934686908417,2016-03-17 22:09:38,This is Beemo. He's a Chubberflop mix. 12/10 would cross the world for https://t.co/kzMVMU8HBV,Beemo,,1.2,https://pbs.twimg.com/media/CdyE2x1W8AAe0TG.jpg,4,Pembroke,0.982004,True,Cardigan,0.000894347,True,malamute,0.0007549899999999999,True,2107,4968
922,710283270106132480,2016-03-17 01:55:02,This is Gunner. He's a Figamus Newton. King of the peek-a-boo. Cool jeans. 11/10 https://t.co/ONuBILIYXZ,Gunner,,1.1,https://pbs.twimg.com/media/Cdtu3WRUkAAsRVx.jpg,2,Shih-Tzu,0.932401,True,Lhasa,0.00308057,True,Tibetan_terrier,0.0008974279999999999,True,580,2308
923,710272297844797440,2016-03-17 01:11:26,We ðŸ‘ðŸ» only ðŸ‘ðŸ» rate ðŸ‘ðŸ» dogs. Pls stop sending in non-canines like this Dutch Panda Worm. This is infuriating. 11/10 https://t.co/odfLzBonG2,,,1.1,https://pbs.twimg.com/media/Cdtk414WoAIUG0v.jpg,1,Old_English_sheepdog,0.586307,True,wire-haired_fox_terrier,0.0118622,True,Lakeland_terrier,0.0106806,True,1425,4945
924,710269109699739648,2016-03-17 00:58:46,"The squad is back for St. Patrick's Day! â˜˜ ðŸ’š
13/10 for all https://t.co/OcCDb2bng5",,,1.3,https://pbs.twimg.com/media/Cdth_KyWEAEXH3u.jpg,1,pug,0.415495,True,German_shepherd,0.017815699999999997,True,Labrador_retriever,0.0100202,True,1257,2613
925,710153181850935296,2016-03-16 17:18:07,This is Lacy. She's tipping her hat to you. Daydreams of her life back on the frontier. 11/10 would pet so well https://t.co/fG5Pk3Et1I,Lacy,,1.1,https://pbs.twimg.com/media/Cdr4jO2UAAAIo6W.jpg,2,cowboy_hat,0.979053,False,sombrero,0.00106825,False,cocker_spaniel,0.00027129599999999997,True,1006,3153
926,710140971284037632,2016-03-16 16:29:35,This is Tater. His underbite is fierce af. Doesn't give a damn about your engagement photo. 8/10 https://t.co/nLuPY3pY12,Tater,,0.8,https://pbs.twimg.com/media/Cdrtcr-W4AAqi5H.jpg,1,Pekinese,0.95317,True,papillon,0.00195169,True,Japanese_spaniel,0.000582051,True,1008,3017
927,710117014656950272,2016-03-16 14:54:24,This pupper got her hair chalked for her birthday. Hasn't told her parents yet. Rebellious af. 11/10 very nifty https://t.co/h1OX2mLtxV,,pupper,1.1,https://pbs.twimg.com/media/CdrXp9dWoAAcRfn.jpg,2,toy_poodle,0.802092,True,miniature_poodle,0.0111647,True,cocker_spaniel,0.00628662,True,2233,5999
928,709918798883774466,2016-03-16 01:46:45,Meet Watson. He's a Suzuki Tickleboop. Leader of a notorious biker gang. Only one ear functional. 12/10 snuggable af https://t.co/R1gLc5vDqG,Watson,,1.2,https://pbs.twimg.com/media/CdojYQmW8AApv4h.jpg,2,Pembroke,0.956222,True,Cardigan,0.00207273,True,Chihuahua,0.000791218,True,1215,3250
929,709901256215666688,2016-03-16 00:37:03,"WeRateDogs stickers are here and they're 12/10! Use code ""puppers"" at checkout ðŸ¶ðŸ¾

Shop now: https://t.co/k5xsufRKYm https://t.co/ShXk46V13r",,pupper,1.2,https://pbs.twimg.com/media/CdoTbL_XIAAitq2.jpg,2,bib,0.998814,False,handkerchief,5.1177299999999995e-05,False,umbrella,2.24477e-05,False,112,732
930,709852847387627521,2016-03-15 21:24:41,*lets out a tiny whimper and then collapses* ...12/10 https://t.co/BNdVZEHRow,,,1.2,https://pbs.twimg.com/media/CdnnZhhWAAEAoUc.jpg,2,Chihuahua,0.945629,True,Pomeranian,0.00192036,True,West_Highland_white_terrier,0.00101342,True,1336,3824
931,709566166965075968,2016-03-15 02:25:31,This is Olaf. He's gotta be rare. Seems sturdy. Tail is floofy af. 12/10 would do whatever it takes to pet https://t.co/E9jaU59bh9,Olaf,,1.2,https://pbs.twimg.com/media/Cdjiqi6XIAIUOg-.jpg,1,chow,0.999837,True,Tibetan_mastiff,1.16907e-05,True,Australian_terrier,1.1338399999999999e-06,True,1367,3865
932,709556954897764353,2016-03-15 01:48:55,This is Cecil. She's a Gigglefloof Poofer. Outdoorsy af. One with nature. 12/10 would strategically capture https://t.co/ijJB0DuOIC,Cecil,,1.2,https://pbs.twimg.com/media/CdjaSFCWAAAJZh3.jpg,2,golden_retriever,0.790026,True,kuvasz,0.0105031,True,Labrador_retriever,0.00870512,True,1204,3593
933,709519240576036864,2016-03-14 23:19:03,This is Vince. He's a Gregorian Flapjeck. White spot on legs almost looks like another dog (whoa). 9/10 rad as hell https://t.co/aczGAV2dK4,Vince,,0.9,https://pbs.twimg.com/media/Cdi3-f7W8AUOm9T.jpg,1,cocker_spaniel,0.414982,True,Newfoundland,0.022548199999999997,True,flat-coated_retriever,0.0196789,True,277,1620
934,709449600415961088,2016-03-14 18:42:20,Meet Karma. She's just a head. Lost body during the Second Punic War (unfortunate). Loves to travel 10/10 petable af https://t.co/c6af6nYEPo,Karma,,1.0,https://pbs.twimg.com/media/Cdh4pgAW0AEKJ_a.jpg,2,Maltese_dog,0.780187,True,Dandie_Dinmont,0.007442869999999999,True,Norfolk_terrier,0.0033776199999999987,True,665,2420
935,709409458133323776,2016-03-14 16:02:49,This is Billy. He sensed a squirrel. 8/10 damn it Billy https://t.co/Yu0K98VZ9A,Billy,,0.8,https://pbs.twimg.com/media/CdhUIMSUIAA4wYK.jpg,1,Shetland_sheepdog,0.79745,True,collie,0.00540553,True,keeshond,0.0031673300000000003,True,788,2855
936,709225125749587968,2016-03-14 03:50:21,This is Walker. He's a Butternut Khalifa. Appears fuzzy af. 11/10 would hug for a ridiculous amount of time https://t.co/k6fEWHSALn,Walker,,1.1,https://pbs.twimg.com/media/Cdese-zWEAArIqE.jpg,1,Labrador_retriever,0.271109,True,Pomeranian,0.015048699999999998,True,golden_retriever,0.014557800000000001,True,647,2615
937,709207347839836162,2016-03-14 02:39:42,This is Penny. She's trying on her prom dress. Stunning af 11/10 https://t.co/qcZDZGCapg,Penny,,1.1,https://pbs.twimg.com/media/CdecUSzUIAAHCvg.jpg,1,Chihuahua,0.948323,True,Italian_greyhound,0.00177303,True,quilt,0.0016687900000000003,False,6567,13755
938,709198395643068416,2016-03-14 02:04:08,"From left to right:
Cletus, Jerome, Alejandro, Burp, &amp; Titson
None know where camera is. 45/50 would hug all at once https://t.co/sedre1ivTK",,,0.9,https://pbs.twimg.com/media/CdeUKpcWoAAJAWJ.jpg,1,borzoi,0.490783,True,wire-haired_fox_terrier,0.00835133,True,English_setter,0.00831843,True,721,2634
939,709158332880297985,2016-03-13 23:24:56,Meet Rodney. He's a Ukranian Boomchicka. Outside but would like to be inside. Only has one ear (unfortunate) 10/10 https://t.co/FjAj3ggXrR,Rodney,,1.0,https://pbs.twimg.com/media/CddvvSwWoAUObQw.jpg,1,Siberian_husky,0.212957,True,Eskimo_dog,0.0178887,True,Labrador_retriever,0.0174218,True,470,2236
940,709042156699303936,2016-03-13 15:43:18,This is Klevin. He's addicted to sandwiches (yes a hotdog is a sandwich fight me) It's tearing his family apart 9/10 https://t.co/7BkkVNu5pd,Klevin,,0.9,https://pbs.twimg.com/media/CdcGBB3WwAAGBuU.jpg,1,hotdog,0.8265790000000001,False,Rottweiler,0.00681793,True,Labrador_retriever,0.0049217900000000005,True,1864,5197
941,708845821941387268,2016-03-13 02:43:08,Here's a pupper with magic eyes. Not wearing a seat belt tho (irresponsible af). Very distracting to driver. 9/10 https://t.co/5DLJB4ssvI,,pupper,0.9,https://pbs.twimg.com/media/CdZTgynWwAATZcx.jpg,1,schipperke,0.74564,True,kelpie,0.0167853,True,Boston_bull,0.0014762900000000001,True,1015,3226
942,708834316713893888,2016-03-13 01:57:25,Meet Malikai. He was rolling around having fun when he remembered the inevitable heat death of the universe. 10/10 https://t.co/Vd2FqHIIGn,Malikai,,1.0,https://pbs.twimg.com/media/CdZI_bpWEAAm1fs.jpg,1,Eskimo_dog,0.283945,True,giant_panda,0.0218252,False,malamute,0.0180401,True,571,1860
943,708810915978854401,2016-03-13 00:24:26,This is Mister. He's a wonderful father to his two pups. Heartwarming af. 10/10 for all https://t.co/2KcuJXL2r4,Mister,,1.0,https://pbs.twimg.com/media/CdYzwuYUIAAHPkB.jpg,2,golden_retriever,0.976139,True,Labrador_retriever,0.00163009,True,Norfolk_terrier,0.000187137,True,7848,18036
944,708738143638450176,2016-03-12 19:35:15,This is Coco. She gets to stay on the Bachelor for another week. Super pumped 11/10 https://t.co/wsCB6LFNxD,Coco,,1.1,https://pbs.twimg.com/media/CdXxlFPWwAABaOv.jpg,1,Pomeranian,0.933457,True,Samoyed,0.005722080000000001,True,West_Highland_white_terrier,9.04151e-05,True,917,2997
945,708711088997666817,2016-03-12 17:47:45,This is Smokey. He really likes tennis balls. 11/10 https://t.co/Ah7WlYTUBQ,Smokey,,1.1,https://pbs.twimg.com/media/CdXY-GHWoAALing.jpg,2,tennis_ball,0.912961,False,German_short-haired_pointer,0.00526946,True,Labrador_retriever,0.00184774,True,834,2790
946,708479650088034305,2016-03-12 02:28:06,Meet Bear. He's a Beneboop Cumberclap. Extremely unamused. 13/10 I'm in love with this picture https://t.co/uC8kUqAz0W,Bear,,1.3,https://pbs.twimg.com/media/CdUGcLMWAAI42q0.jpg,1,Shih-Tzu,0.218479,True,Lhasa,0.020196600000000002,True,Norfolk_terrier,0.016522500000000002,True,765,2768
947,708469915515297792,2016-03-12 01:49:25,This is Bobble. He's a Croatian Galifianakis. Hears everything within 400 miles. 11/10 would snug diligently https://t.co/VwDc6PTDzk,Bobble,,1.1,https://pbs.twimg.com/media/CdT9n7mW0AQcpZU.jpg,1,Chihuahua,0.748163,True,toy_terrier,0.0127717,True,Pembroke,0.0042141,True,926,3357
948,708356463048204288,2016-03-11 18:18:36,This is Oliver. That is his castle. He protects it with his life. He's also squishy af. 10/10 would squish softly https://t.co/oSuEGw0BhX,Oliver,,1.0,https://pbs.twimg.com/media/CdSWcc1XIAAXc6H.jpg,2,pug,0.871283,True,French_bulldog,0.004182,True,bath_towel,0.0015228,False,1520,3929
949,708349470027751425,2016-03-11 17:50:48,This is River. He's changing the trumpet game. Innovative af. 11/10 such a good boy https://t.co/tK7a0AxQfd,River,,1.1,https://pbs.twimg.com/media/CdSQFWOWAAApgfq.jpg,1,muzzle,0.24389,False,basenji,0.018715799999999998,True,Boston_bull,0.0092727,True,831,2568
950,708149363256774660,2016-03-11 04:35:39,This is Jebberson. He's the reigning hide and seek world champion. 10/10 hasn't lost his touch https://t.co/VEFkvWCoHF,Jebberson,,1.0,https://pbs.twimg.com/media/CdPaEkHW8AA-Wom.jpg,1,Cardigan,0.350993,True,basset,0.0164555,True,toy_terrier,0.008048360000000001,True,1727,4672
951,708130923141795840,2016-03-11 03:22:23,Please stop sending in non canines like this Guatemalan Twiggle Bunny. We only rate dogs. Only send in dogs... 11/10 https://t.co/XKhobeGuvT,,,1.1,https://pbs.twimg.com/media/CdPJUWIWIAAIchl.jpg,1,French_bulldog,0.710354,True,Chihuahua,0.0262302,True,Cardigan,0.000690382,True,943,3707
952,708119489313951744,2016-03-11 02:36:57,This is Cooper. He basks in the glory of rebellion. 9/10 probably a preteen https://t.co/kDamUfeIpm,Cooper,,0.9,https://pbs.twimg.com/media/CdO-6x5W8AENSBJ.jpg,1,Norwich_terrier,0.264483,True,Norfolk_terrier,0.0258786,True,chow,0.00968987,True,1102,2937
953,708109389455101952,2016-03-11 01:56:49,This is Remington. He was caught off guard by the magical floating cheese. Spooked af. 10/10 deep breaths pup https://t.co/mhPSADiJmZ,Remington,,1.0,https://pbs.twimg.com/media/CdO1u9vWAAApj2V.jpg,1,Staffordshire_bullterrier,0.5161060000000001,True,American_Staffordshire_terrier,0.0236075,True,kelpie,0.006974950000000001,True,610,2124
954,708026248782585858,2016-03-10 20:26:26,Everybody stop what you're doing and watch this video. Frank is stuck in a loop. 13/10 (Vid by @klbmatty) https://t.co/5AJs8TIV1U,,,1.3,https://pbs.twimg.com/ext_tw_video_thumb/708026062568087553/pu/img/rNhylAwIfb6YthGu.jpg,1,malinois,0.7864680000000001,True,Chesapeake_Bay_retriever,0.006897889999999999,True,Siamese_cat,0.0029304400000000003,False,2166,4799
955,707995814724026368,2016-03-10 18:25:30,This is Farfle. He lost his back legs during the Battle of Gettysburg. Goes 0-60 in 4.3 seconds (damn) 12/10 hero af https://t.co/NiQQWzIzzq,Farfle,,1.2,https://pbs.twimg.com/media/CdNOb17WwAA5z4A.jpg,1,agama,0.172087,False,Gila_monster,0.0126978,False,lumbermill,0.00504,False,1273,3385
956,707969809498152960,2016-03-10 16:42:10,Meet Rufus. He's a Honeysuckle Firefox. Curly af. Badass tie. About to go on his first date ever 11/10 good luck pup https://t.co/dGoTWNfIsm,Rufus,,1.1,https://pbs.twimg.com/media/CdM2xRpXEAUsR4k.jpg,1,toy_poodle,0.908491,True,miniature_poodle,0.00826516,True,teddy,0.000578613,False,1097,2941
957,707776935007539200,2016-03-10 03:55:45,This is Sadie. She's a Bohemian Rhapsody. Remarkably portable. Could sneak on roller coasters with (probably). 11/10 https://t.co/DB8fyeDs8B,Sadie,,1.1,https://pbs.twimg.com/media/CdKHWimWoAABs08.jpg,1,miniature_pinscher,0.890426,True,toy_terrier,0.005133469999999999,True,Chihuahua,0.0018015300000000002,True,1079,3593
958,707741517457260545,2016-03-10 01:35:01,When your roommate eats your leftover Chili's but you pretend it's no big deal cuz you fat anyway. 10/10 head up pup https://t.co/0nMgoue8IR,,,1.0,https://pbs.twimg.com/media/CdJnJ1dUEAARNcf.jpg,1,whippet,0.738371,True,Italian_greyhound,0.0191789,True,American_Staffordshire_terrier,0.00201257,True,696,2718
959,707693576495472641,2016-03-09 22:24:31,This is Jiminus. He's in a tub for some reason. What a jokester. Smh 7/10 churlish af https://t.co/84L4ED9Tpi,Jiminus,,0.7,https://pbs.twimg.com/media/CdI7jDnW0AA2dtO.jpg,1,bathtub,0.499525,False,tub,0.04880140000000001,False,washbasin,0.0009298249999999999,False,1133,3765
960,707420581654872064,2016-03-09 04:19:44,This is Keurig. He's a rare dog. Laughs like an idiot tho. Head is basically a weapon. Poorly maintained goatee 4/10 https://t.co/xOrUyj7K30,Keurig,,0.4,https://pbs.twimg.com/media/CdFDQVgWIAArslx.jpg,1,ram,0.518215,False,kuvasz,0.0149391,True,Great_Pyrenees,0.0106003,True,789,2499
961,707411934438625280,2016-03-09 03:45:22,"""I shall trip the big pupper with leash. Big pupper will never see it coming. I am a genius."" Both 11/10 https://t.co/uQsCJ8pf51",,pupper,1.1,https://pbs.twimg.com/media/CdE7ZktXIAEiWLj.jpg,1,Lakeland_terrier,0.7382770000000001,True,Airedale,0.00285149,True,giant_schnauzer,0.0024876300000000002,True,673,2486
962,707387676719185920,2016-03-09 02:08:59,Meet Clarkus. He's a Skinny Eastern Worcestershire. Can tie own shoes (impressive af) 10/10 would put on track team https://t.co/XP5o7zGn0E,Clarkus,,1.0,https://pbs.twimg.com/media/CdElVm7XEAADP6o.jpg,1,Chihuahua,0.888468,True,Italian_greyhound,0.00886346,True,toy_terrier,0.0015938299999999999,True,1490,3835
963,707377100785885184,2016-03-09 01:26:57,This dog just brutally murdered a snowman. Currently toying with its nutritious remains 9/10 would totally still pet https://t.co/iKThgKnW1j,,,0.9,https://pbs.twimg.com/media/CdEbt0NXIAQH3Aa.jpg,1,golden_retriever,0.637225,True,bloodhound,0.009454210000000001,True,cocker_spaniel,0.00697971,True,1214,3603
964,707315916783140866,2016-03-08 21:23:50,This is Finnegus. He's trapped in a snow globe. Poor pupper. 10/10 would make sure no one shook it https://t.co/BjpOa52jQ4,Finnegus,pupper,1.0,https://pbs.twimg.com/media/CdDkEkHWwAAAeUJ.jpg,2,Bernese_mountain_dog,0.979235,True,Shetland_sheepdog,0.00110368,True,Appenzeller,0.000397111,True,727,2698
965,707297311098011648,2016-03-08 20:09:54,This is Cassie. She can go from sweet to scary af in a matter of seconds. 10/10 points deducted for cats on pajamas https://t.co/B6dmZmJBdK,Cassie,,1.0,https://pbs.twimg.com/media/CdDTJLMW4AEST--.jpg,1,Blenheim_spaniel,0.370717,True,Shih-Tzu,0.0201566,True,black-footed_ferret,0.010155899999999999,False,903,3022
966,707059547140169728,2016-03-08 04:25:07,Say hello to Cupcake. She's an Icelandic Dippen Dot. Confused by the oddly geometric lawn pattern. 11/10 https://t.co/D7rorf4YKL,Cupcake,,1.1,https://pbs.twimg.com/media/Cc_64zVWEAAeXs7.jpg,1,Samoyed,0.8973120000000001,True,Great_Pyrenees,0.0039180199999999995,True,kuvasz,0.0019516,True,759,2796
967,707038192327901184,2016-03-08 03:00:15,This is Kathmandu. He sees every move you make. Probably knows Jiu-Jitsu. 10/10 mysterious af https://t.co/z0cs7E4Xjj,Kathmandu,,1.0,https://pbs.twimg.com/media/Cc_ney1W4AANuY3.jpg,1,pug,0.642426,True,llama,0.0057306200000000005,False,French_bulldog,0.00541865,True,900,2404
968,707021089608753152,2016-03-08 01:52:18,This is Tucker. He's a Dasani Episcopalian. Good lord what a tongue. 12/10 would never let go of https://t.co/gHtW5cgyy7,Tucker,,1.2,https://pbs.twimg.com/media/Cc_XtkRW8AEE7Fn.jpg,2,cocker_spaniel,0.559658,True,golden_retriever,0.0314673,True,Pekinese,0.00666717,True,1540,4433
969,707014260413456384,2016-03-08 01:25:10,This is Ellie. She requests to be carried around in a lacrosse stick at all times. 11/10 impossible to say no https://t.co/15yCmd43zU,Ellie,,1.1,https://pbs.twimg.com/media/Cc_RsVlXEAIzzlX.jpg,1,Chihuahua,0.58378,True,Italian_greyhound,0.012968299999999999,True,toy_terrier,0.00891527,True,664,2502
970,706901761596989440,2016-03-07 17:58:08,This is Elliot. He's blocking the roadway. Downright rude as hell. Doesn't care that you're already late. 3/10 https://t.co/FMUxir5pYu,Elliot,,0.3,https://pbs.twimg.com/media/Cc9rZlBWwAA56Ra.jpg,1,wild_boar,0.859499,False,hog,0.0128981,False,warthog,0.00113178,False,680,2264
971,706681918348251136,2016-03-07 03:24:33,Say hello to Katie. She's a Mitsubishi Hufflepuff. Curly af. 12/10 I'd do terrible things to acquire such a pup https://t.co/CFPIcGcwJv,Katie,,1.2,https://pbs.twimg.com/media/Cc6jcYRXIAAFuox.jpg,1,toy_poodle,0.717584,True,miniature_poodle,0.015143299999999998,True,Norwich_terrier,0.0047087,True,1103,3627
972,706644897839910912,2016-03-07 00:57:27,Meet Shadow. She's tired of the responsibilities associated with being a dog. No longer strives to attain ball. 9/10 https://t.co/cdOkfEpjFw,Shadow,,0.9,https://pbs.twimg.com/ext_tw_video_thumb/706644797256241152/pu/img/NTqvmIUQExGmKFSR.jpg,1,space_heater,0.137871,False,Chihuahua,0.013292799999999999,True,cougar,0.0113866,False,1224,2814
973,706593038911545345,2016-03-06 21:31:22,Here's a sneak peek of me on spring break. 10/10 so many tired pups these days https://t.co/6aJrjKfNqX,,,1.0,https://pbs.twimg.com/media/Cc5Snc7XIAAMidF.jpg,1,four-poster,0.6964229999999999,False,quilt,0.018931200000000002,False,pillow,0.0029408799999999994,False,718,2363
974,706538006853918722,2016-03-06 17:52:42,"This is Oliver (pronounced ""Ricardo""). He's a ship captain. Controls these treacherous waters. 11/10 would sail with https://t.co/bxjO45rXKd",Oliver,,1.1,https://pbs.twimg.com/media/Cc4gjxqW4AIoThO.jpg,1,chow,0.541794,True,Pembroke,0.00949184,True,Pomeranian,0.008543939999999996,True,1580,3778
975,706516534877929472,2016-03-06 16:27:23,Please enjoy this pup in a cooler. Permanently ready for someone to throw a tennis ball his way. 12/10 https://t.co/KUS0xl7XIp,,,1.2,https://pbs.twimg.com/media/Cc4NCQiXEAEx2eJ.jpg,1,golden_retriever,0.7726850000000001,True,Labrador_retriever,0.00716653,True,golfcart,0.00209931,False,1150,3404
976,706346369204748288,2016-03-06 05:11:12,This is Koda. She's a Beneboom Cumberwiggle. 12/10 petable as hell https://t.co/VZV6oMJmU6,Koda,,1.2,https://pbs.twimg.com/media/Cc1yRE2WoAAgxFQ.jpg,1,Tibetan_mastiff,0.956462,True,Rottweiler,0.0025380900000000002,True,Appenzeller,0.000867921,True,1035,3768
977,706310011488698368,2016-03-06 02:46:44,Here's a very sleepy pupper. Thinks it's an airplane. 12/10 would snug for eternity https://t.co/GGmcTIkBbf,,pupper,1.2,https://pbs.twimg.com/media/Cc1RNHLW4AACG6H.jpg,1,Pembroke,0.6981649999999999,True,Chihuahua,0.0105834,True,bloodhound,0.00620304,True,9034,23443
978,706291001778950144,2016-03-06 01:31:11,When you're just relaxin and having a swell time but then remember you have to fill out the FAFSA ...11/10 https://t.co/qy33OBcexg,,,1.1,https://pbs.twimg.com/media/Cc0_2tXXEAA2iTY.jpg,1,Border_terrier,0.587101,True,bull_mastiff,0.0164087,True,Staffordshire_bullterrier,0.0105011,True,522,1861
979,706265994973601792,2016-03-05 23:51:49,"This is Kara. She's been trying to solve that thing for 3 days. ""I don't have thumbs,"" she said. 11/10 solid effort https://t.co/lA6a8GefrV",Kara,,1.1,https://pbs.twimg.com/media/Cc0pLU0WAAEfGEw.jpg,1,papillon,0.743715,True,Pekinese,0.0114042,True,Saint_Bernard,0.00477152,True,1030,2979
980,706166467411222528,2016-03-05 17:16:20,This is Dexter. He's a shy pup. Doesn't bark much. Dreadful fetcher. Has rare sun allergy. 7/10 still petable https://t.co/sA7P3JSqiv,Dexter,,0.7,https://pbs.twimg.com/media/CczOp_OWoAAo5zR.jpg,1,Samoyed,0.430418,True,kuvasz,0.027960000000000002,True,Great_Pyrenees,0.011748,True,1819,5636
981,705975130514706432,2016-03-05 04:36:02,This is Adele. Her tongue flies out of her mouth at random. It's a debilitating illness. 10/10 stay strong pupper https://t.co/cfn81n3FLO,Adele,pupper,1.0,https://pbs.twimg.com/media/CcwgjmuXIAEQoSd.jpg,1,Staffordshire_bullterrier,0.5877640000000001,True,American_Staffordshire_terrier,0.0281429,True,bull_mastiff,0.00947981,True,842,3397
982,705970349788291072,2016-03-05 04:17:02,This is Lucy. She's a Venetian Kerploof. Supposed to be navigating. Quite irresponsible. Fancy ass collar tho 12/10 https://t.co/8tjnz1L8DI,Lucy,,1.2,https://pbs.twimg.com/media/CcwcSS9WwAALE4f.jpg,1,golden_retriever,0.776346,True,Labrador_retriever,0.0112413,True,chow,0.0036952899999999995,True,1008,3440
983,705898680587526145,2016-03-04 23:32:15,Meet Max. He's a Fallopian Cephalopuff. Eyes are magical af. Lil dandruff problem. No big deal 10/10 would still pet https://t.co/c67nUjwmFs,Max,,1.0,https://pbs.twimg.com/media/CcvbGj5W8AARjB6.jpg,1,collie,0.808276,True,Border_collie,0.0059437,True,groenendael,0.0026720299999999997,True,643,2597
984,705786532653883392,2016-03-04 16:06:36,"Seriously, add us ðŸ¶ 11/10 for sad wet pupper https://t.co/xwPE9faVZR",,pupper,1.1,https://pbs.twimg.com/media/Cct1G6vVAAI9ZjF.jpg,1,web_site,0.550294,False,Labrador_retriever,0.014849600000000001,True,golden_retriever,0.0148482,True,596,2132
985,705591895322394625,2016-03-04 03:13:11,"""Ma'am, for the last time, I'm not authorized to make that type of transaction"" 11/10 https://t.co/nPTBsdm3BF",,,1.1,https://pbs.twimg.com/media/CcrEFQdUcAA7CJf.jpg,1,basenji,0.877207,True,Italian_greyhound,0.00478542,True,miniature_pinscher,0.0035638099999999997,True,1308,3475
